paper_id,title,doi,source,pdf_url,status,filename,timestamp
69b8b36d8aad,"A Quantum Risk Management Framework (QRMF): Quantum Amplitude Estimation for VaR/CVaR, Entanglement-Based Systemic Risk Analytics, and Variational Risk Optimization",10.20944/preprints202510.0505.v1,manual_import,,success,69b8b36d8aad_a_quantum_risk_management_framework_qrmf_quantum_amplitude_estimation_for_var_cv.pdf,2026-04-06T16:44:35
69bf4c1b7cbe,A Quantum-Inspired Binary Optimization Algorithm for Representative Selection,,cached,,success,69bf4c1b7cbe_a_quantum_inspired_binary_optimization_algorithm_for_representative_selection.pdf,2026-03-31T11:00:26
69bfce9095d0,Genetically Engineered Quantum Circuits for Financial Market Indicators,,cached,,success,69bfce9095d0_genetically_engineered_quantum_circuits_for_financial_market_indicators.pdf,2026-03-31T11:00:26
6ac0d0a3c55a,End-to-end resource analysis for quantum interior point methods and portfolio optimization,10.48550/arxiv.2211.12489,arxiv,https://arxiv.org/pdf/2211.12489.pdf,success,6ac0d0a3c55a_end_to_end_resource_analysis_for_quantum_interior_point_methods_and_portfolio_op.pdf,2026-03-30T12:49:59
6b2b4f6ba298,"&lt;div&gt; Multiplicative-Weights Methods and Gibbs-State Preparation for Conic Portfolio Optimization:&amp;nbsp;&lt;/div&gt;&lt;div&gt; A Mathematical Framework Connecting Quantum Algorithms, Jordan Algebras, and Quantitative Finance&lt;/div&gt;",10.2139/ssrn.6103666,manual_import,,success,6b2b4f6ba298_lt_div_gt_multiplicative_weights_methods_and_gibbs_state_preparation_for_conic_p.pdf,2026-04-06T16:44:35
6bbc4a2d4a89,Quantum Computing Applications,10.1201/9781003499459-3,manual_import,,download_failed,,2026-04-06T16:44:35
6cb040f251ff,Quantum Algorithm for Local-Volatility Option Pricing via the Kolmogorov Equation,,cached,,success,6cb040f251ff_quantum_algorithm_for_local_volatility_option_pricing_via_the_kolmogorov_equatio.pdf,2026-03-31T11:00:33
6cb502a2896a,Continuous Variables Quantum Algorithm for Solving Ordinary Differential Equations,10.1109/QCE57702.2023.10183,cached,,success,6cb502a2896a_continuous_variables_quantum_algorithm_for_solving_ordinary_differential_equatio.pdf,2026-03-31T11:00:33
6ce12ea7c2bf,A Collaborative Framework for Quantum Optimisation and Quantum Neural Networks: Credit Feature Selection and Image Classification,,semantic_scholar,https://arxiv.org/pdf/2509.11110.pdf,success,6ce12ea7c2bf_a_collaborative_framework_for_quantum_optimisation_and_quantum_neural_networks_c.pdf,2026-03-30T12:50:20
6d5768682408,Solving the Product Breakdown Structure Problem with constrained QAOA,10.48550/arxiv.2406.15228,arxiv,https://arxiv.org/pdf/2406.15228.pdf,success,6d5768682408_solving_the_product_breakdown_structure_problem_with_constrained_qaoa.pdf,2026-03-30T12:50:21
6df543f1353b,Variational quantum Monte Carlo simulations with tensor-network states,10.1103/PhysRevLett.99.220602,cached,,success,6df543f1353b_variational_quantum_monte_carlo_simulations_with_tensor_network_states.pdf,2026-03-31T11:00:33
6e0380dce3b2,Accelerating Quantum Monte Carlo Calculations with Set-Equivariant Architectures and Transfer Learning,,manual,,success,6e0380dce3b2_accelerating_quantum_monte_carlo_calculations_with_set_equivariant_architectures.pdf,2026-04-01T20:32:41
6e5c81beaefd,Classification of Financial Data Using Quantum Support Vector Machine,10.48550/arXiv.2412.10860,arxiv,https://arxiv.org/pdf/2412.10860.pdf,success,6e5c81beaefd_classification_of_financial_data_using_quantum_support_vector_machine.pdf,2026-03-30T12:50:30
6e6696a9c05a,Quantum Time Series Similarity Measures and Quantum Temporal Kernels,,cached,,success,6e6696a9c05a_quantum_time_series_similarity_measures_and_quantum_temporal_kernels.pdf,2026-03-31T11:00:35
6eb61c248ea7,Decoherence in adiabatic quantum computation,10.1103/PhysRevA.91.062320,cached,,success,6eb61c248ea7_decoherence_in_adiabatic_quantum_computation.pdf,2026-03-31T11:00:35
6f039fcdad9d,Variational quantum algorithm based on Lagrange polynomial encoding to solve differential equations ,10.1103/PhysRevA.111.062404,semantic_scholar,https://arxiv.org/pdf/2407.16363.pdf,success,6f039fcdad9d_variational_quantum_algorithm_based_on_lagrange_polynomial_encoding_to_solve_dif.pdf,2026-03-30T12:50:44
6f139839ae4c,Quantum Reservoir Computing for Statistical Classification in a Superconducting Quantum Circuit,,semantic_scholar,https://arxiv.org/pdf/2602.15474.pdf,success,6f139839ae4c_quantum_reservoir_computing_for_statistical_classification_in_a_superconducting_.pdf,2026-03-30T12:50:49
6fe2aeb67e66,Quantum Computing,10.1002/9781119777465.ch4,institutional,http://esc-web.lib.cbs.dk/login?url=https://doi.org/10.1002/9781119777465.ch4,download_failed,,2026-04-01T09:43:26
7012f13a70a3,Unsupervised Quantum Anomaly Detection on Noisy Quantum Processors,10.48550/arxiv.2411.16970,arxiv,https://arxiv.org/pdf/2411.16970.pdf,success,7012f13a70a3_unsupervised_quantum_anomaly_detection_on_noisy_quantum_processors.pdf,2026-03-30T12:50:54
70217d6e8f7f,hybrid quantum classical algorithm for robust optimization via stochastic gradie,,zotero,,success,70217d6e8f7f_hybrid_quantum_classical_algorithm_for_robust_optimization_via_stochastic_gradie.pdf,2026-04-01T10:38:14
7055fc9f6caf,Quantum algorithm for unsupervised anomaly detection,10.1016/j.physa.2023.129018,cached,,success,7055fc9f6caf_quantum_algorithm_for_unsupervised_anomaly_detection.pdf,2026-03-31T11:00:37
71966c8a9dc7,"Big Data in Financial Risk Management: Predictive Modeling, Real-Time Assessment and Emerging Challenges",10.5281/zenodo.17799618,cached,,success,71966c8a9dc7_big_data_in_financial_risk_management_predictive_modeling_real_time_assessment_a.pdf,2026-03-31T11:00:37
71dc25d5ac6a,Leveraging Quantum Computing and Optimization to Estimate Financial Crashes in Small and Medium-Sized Enterprises,10.1109/ubmk63289.2024.10773505,institutional,https://ieeexplore-ieee-org.esc-web.lib.cbs.dk/stampPDF/getPDF.jsp?tp=&arnumber=10773505&ref=,success,71dc25d5ac6a_leveraging_quantum_computing_and_optimization_to_estimate_financial_crashes_in_s.pdf,2026-03-31T22:43:29
71e349feba65,Quantum Machine Learning for Multi-Criteria Decision-Making in Industrial Project Portfolio Management,10.62802/km136t27,cached,,success,71e349feba65_quantum_machine_learning_for_multi_criteria_decision_making_in_industrial_projec.pdf,2026-03-31T11:00:47
71ed62112b8d,Exploring the Revolutionary Potential of Quantum Technologies in the Fintech Industry,10.63949/crinfo.v1i3.004,cached,,success,71ed62112b8d_exploring_the_revolutionary_potential_of_quantum_technologies_in_the_fintech_ind.pdf,2026-03-31T11:00:47
7301808f6d01,Emerging Technologies in Financial Process Optimization and Risk Management,10.4018/979-8-3693-4369-2.ch002,institutional,http://esc-web.lib.cbs.dk/login?url=https://doi.org/10.4018/979-8-3693-4369-2.ch002,download_failed,,2026-03-31T22:43:32
732f54a585cf,Enhanced Ransomware Detection using a Hybrid Quantum-Classical Convolutional Neural Network with Boosted Sooty Tern Optimization,10.1109/icsadl65848.2025.10933393,institutional,https://ieeexplore-ieee-org.esc-web.lib.cbs.dk/stampPDF/getPDF.jsp?tp=&arnumber=10933393&ref=,success,732f54a585cf_enhanced_ransomware_detection_using_a_hybrid_quantum_classical_convolutional_neu.pdf,2026-03-31T22:53:33
73f3adac41d9,Solving Portfolio Optimization Problems using Adiabatic Quantum Computing,10.21203/rs.3.rs-6986668/v1,cached,,success,73f3adac41d9_solving_portfolio_optimization_problems_using_adiabatic_quantum_computing.pdf,2026-03-31T11:01:02
740ccc3ae6f8,advanced_quantum_monte_carlo.py — Quantum Amplitude Estimation Classical Benchmark for Finance,10.5281/zenodo.18079567,institutional,http://esc-web.lib.cbs.dk/login?url=https://doi.org/10.5281/zenodo.18079567,download_failed,,2026-03-31T22:43:38
74c6ac2ca350,Solving General QUBOs with Warm-Start QAOA via a Reduction to Max-Cut,10.48550/arxiv.2504.06253,arxiv,https://arxiv.org/pdf/2504.06253.pdf,success,74c6ac2ca350_solving_general_qubos_with_warm_start_qaoa_via_a_reduction_to_max_cut.pdf,2026-03-30T12:51:34
7540346e79ad,algorithmic_trading_vqe.py — Disruptive VQE-Inspired Trading Strategy Optimizer,10.5281/zenodo.18015135,institutional,http://esc-web.lib.cbs.dk/login?url=https://doi.org/10.5281/zenodo.18015135,download_failed,,2026-03-31T22:43:41
75a7b04fa681,Encoding of Probability Distributions for Quantum Monte Carlo Using Tensor Networks,,cached,,success,75a7b04fa681_encoding_of_probability_distributions_for_quantum_monte_carlo_using_tensor_netwo.pdf,2026-03-31T11:01:06
75c40280653d,Automating Financial Analysis with QML Algorithm: A Banking Industry Perspective,10.1109/netcrypt65877.2025.11102448,institutional,https://ieeexplore-ieee-org.esc-web.lib.cbs.dk/stampPDF/getPDF.jsp?tp=&arnumber=11102448&ref=,success,75c40280653d_automating_financial_analysis_with_qml_algorithm_a_banking_industry_perspective.pdf,2026-03-31T22:53:58
75cd91455541,Quantum versus classical generative modelling in finance,10.1088/2058-9565/abd3db,semantic_scholar,https://arxiv.org/pdf/2008.00691.pdf,success,75cd91455541_quantum_versus_classical_generative_modelling_in_finance.pdf,2026-03-30T12:51:54
75d6acf76068,ML-Driven Quantum Portfolio Optimization: Hybrid CNN-LSTM Architecture with Adaptive Zero-Noise Extrapolation on NISQ Devices,10.21203/rs.3.rs-8423464/v1,cached,,success,75d6acf76068_ml_driven_quantum_portfolio_optimization_hybrid_cnn_lstm_architecture_with_adapt.pdf,2026-03-31T11:01:15
75eee58caf3a,Contextual quantum neural networks for stock price prediction,10.1038/s41598-025-34413-5,cached,,success,75eee58caf3a_contextual_quantum_neural_networks_for_stock_price_prediction.pdf,2026-03-31T11:01:15
7600a952f76a,Shallow and Robust QAOA: Improving Feasibility and Hardware Performance via Linear-Chain and Ramp Schedules,10.21203/rs.3.rs-8297477/v1,cached,,success,7600a952f76a_shallow_and_robust_qaoa_improving_feasibility_and_hardware_performance_via_linea.pdf,2026-03-31T11:01:15
76a87207ec32,Quantum Principal Component Analysis for Financial Fraud Detection,10.1109/QAI63978.2025.00014,institutional,https://ieeexplore-ieee-org.esc-web.lib.cbs.dk/stampPDF/getPDF.jsp?tp=&arnumber=11344591&ref=,success,76a87207ec32_quantum_principal_component_analysis_for_financial_fraud_detection.pdf,2026-03-31T22:54:11
76bf72482fcf,A Comparative Analysis of Classical and Quantum Machine Learning Models for Financial Fraud Detection,10.52710/cfs.895,cached,,success,76bf72482fcf_a_comparative_analysis_of_classical_and_quantum_machine_learning_models_for_fina.pdf,2026-03-31T11:01:23
76ee3cb38743,Quantum Speedup of Monte Carlo Integration with respect to the Number of Dimensions and its Application to Finance,10.48550/arxiv.2011.02165,arxiv,https://arxiv.org/pdf/2011.02165.pdf,success,76ee3cb38743_quantum_speedup_of_monte_carlo_integration_with_respect_to_the_number_of_dimensi.pdf,2026-03-30T12:52:16
76ee9fd77e4e,Quantum alternating operator ansatz with PSO optimizer for portfolio optimization problem,10.1016/j.asoc.2025.113419,manual_import,,success,76ee9fd77e4e_quantum_alternating_operator_ansatz_with_pso_optimizer_for_portfolio_optimizatio.pdf,2026-04-06T16:44:35
774364c6da63,hqQUBO: A Hybrid-querying Quantum Optimization Model Validated with 16-qubits on an Ion Trap Quantum Computer for Life Science Applications,,cached,,success,774364c6da63_hqqubo_a_hybrid_querying_quantum_optimization_model_validated_with_16_qubits_on_.pdf,2026-03-31T11:01:24
774d2b8eb9f8,Variational quantum Monte Carlo calculations for solid surfaces,10.1103/PhysRevB.63.235415,semantic_scholar,https://arxiv.org/pdf/cond-mat/0009147.pdf,success,774d2b8eb9f8_variational_quantum_monte_carlo_calculations_for_solid_surfaces.pdf,2026-03-30T12:52:28
775d4b298ecd,Quantum Machine Learning for Anomaly Detection in Consumer Electronics,10.1109/ISVLSI61997.2024.00104,semantic_scholar,https://arxiv.org/pdf/2409.00294.pdf,success,775d4b298ecd_quantum_machine_learning_for_anomaly_detection_in_consumer_electronics.pdf,2026-03-31T11:01:30
778a06edc7f8,Quantum Interference Effects in Social Decision-Making,10.6914/qss.010102,institutional,http://esc-web.lib.cbs.dk/login?url=https://doi.org/10.6914/qss.010102,download_failed,,2026-03-31T22:43:53
77f0bbb6e5f3,Enhancing Interpretability of Quantum-Assisted Blockchain Clustering via AI Agent-Based Qualitative Analysis,10.48550/arXiv.2506.02068,arxiv,https://arxiv.org/pdf/2506.02068.pdf,success,77f0bbb6e5f3_enhancing_interpretability_of_quantum_assisted_blockchain_clustering_via_ai_agen.pdf,2026-03-30T12:52:37
78b97b2dbd8e,Quantum Gated Recurrent Neural Networks,10.1109/TPAMI.2024.3519605,institutional,https://ieeexplore-ieee-org.esc-web.lib.cbs.dk/stampPDF/getPDF.jsp?tp=&arnumber=10806779&ref=,success,78b97b2dbd8e_quantum_gated_recurrent_neural_networks.pdf,2026-03-31T22:54:42
78cc9d5068f3,Quantum Algorithms for Portfolio Optimization,10.1145/3318041.3355465,semantic_scholar,https://arxiv.org/pdf/1908.08040.pdf,success,78cc9d5068f3_quantum_algorithms_for_portfolio_optimization.pdf,2026-03-30T12:52:45
79a526ef5902,Arline Benchmarks: Automated Benchmarking Platform for Quantum Compilers,,cached,,success,79a526ef5902_arline_benchmarks_automated_benchmarking_platform_for_quantum_compilers.pdf,2026-03-31T11:01:41
7a159ec77866,Quantum Computing in High Frequency Trading and Fraud Detection,10.18034/EI.V9I2.549,cached,,success,7a159ec77866_quantum_computing_in_high_frequency_trading_and_fraud_detection.pdf,2026-03-31T11:01:41
7a47e22ecc89,Benchmarking of Quantum and Classical Computing in Large-Scale Dynamic Portfolio Optimization Under Market Frictions,10.48550/arXiv.2502.05226,arxiv,https://arxiv.org/pdf/2502.05226.pdf,success,7a47e22ecc89_benchmarking_of_quantum_and_classical_computing_in_large_scale_dynamic_portfolio.pdf,2026-03-30T12:52:54
7b4855a804c1,Quantum Computations and Option Pricing,10.1142/9789811263699_0027,institutional,http://esc-web.lib.cbs.dk/login?url=https://doi.org/10.1142/9789811263699_0027,download_failed,,2026-03-31T22:43:59
7b4b01100661,"Encoding trade-offs and design toolkits in quantum algorithms for discrete optimization: coloring, routing, scheduling, and other problems",10.22331/q-2023-09-14-1111,cached,,success,7b4b01100661_encoding_trade_offs_and_design_toolkits_in_quantum_algorithms_for_discrete_optim.pdf,2026-03-31T11:01:48
7bdb6593ec48,Advancing Bi-Objective Weighted Portfolio Optimization Across International Markets via Quantum Annealing,10.1109/qce65121.2025.00245,institutional,https://ieeexplore-ieee-org.esc-web.lib.cbs.dk/stampPDF/getPDF.jsp?tp=&arnumber=11249851&ref=,success,7bdb6593ec48_advancing_bi_objective_weighted_portfolio_optimization_across_international_mark.pdf,2026-03-31T22:54:54
7c11ab76f3d9,Benchmarking Quantum Solvers in Noisy Digital Simulations for Financial Portfolio Optimization,,cached,,success,7c11ab76f3d9_benchmarking_quantum_solvers_in_noisy_digital_simulations_for_financial_portfoli.pdf,2026-03-31T11:01:56
7c2e539656f7,Neural networks for estimating Macro Asset Pricing model in football clubs,10.1002/isaf.1532,institutional,https://onlinelibrary-wiley-com.esc-web.lib.cbs.dk/doi/pdfdirect/10.1002/isaf.1532,success,7c2e539656f7_neural_networks_for_estimating_macro_asset_pricing_model_in_football_clubs.pdf,2026-03-31T22:55:05
7c5f50a7c9b3,Quantum Computing Algorithms for Nonlinear Optimization Problems,10.52783/cana.v30.279,semantic_scholar,https://internationalpubls.com/index.php/cana/article/download/279/349,success,7c5f50a7c9b3_quantum_computing_algorithms_for_nonlinear_optimization_problems.pdf,2026-03-30T12:53:21
7c6e8af63f61,Constrained Portfolio Optimization via Quantum Approximate Optimization Algorithm (QAOA) with XY-Mixers and Trotterized Initialization: A Hybrid Approach for Direct Indexing,,recovery_s2,https://arxiv.org/pdf/2602.14827.pdf,success,7c6e8af63f61_constrained_portfolio_optimization_via_quantum_approximate_optimization_algorith.pdf,2026-03-31T12:45:45
7c795b799d02,Credit Default Prediction with Projected Quantum Feature Models and Ensembles,,cached,,success,7c795b799d02_credit_default_prediction_with_projected_quantum_feature_models_and_ensembles.pdf,2026-03-31T11:01:58
7cc9ce4dad7d,Detecting Financial Fraud: A Comparative Study of Quantum-Based Supervised Learning Algorithms,10.1007/978-981-96-9184-5_12,institutional,https://link-springer-com.esc-web.lib.cbs.dk/content/pdf/10.1007/978-981-96-9184-5.pdf,success,7cc9ce4dad7d_detecting_financial_fraud_a_comparative_study_of_quantum_based_supervised_learni.pdf,2026-03-31T22:55:25
7cce475cb4b7,A variational quantum perceptron with Grover’s algorithm for efficient classification,10.1088/1402-4896/ad3e38,semantic_scholar,https://arxiv.org/pdf/2305.11040.pdf,success,7cce475cb4b7_a_variational_quantum_perceptron_with_grover_s_algorithm_for_efficient_classific.pdf,2026-03-30T12:53:37
7cfdb2957f6c,Demonstration of quantum linear equation solver on the IBM qiskit platform,10.1109/dcabes50732.2020.00086,institutional,https://ieeexplore-ieee-org.esc-web.lib.cbs.dk/stampPDF/getPDF.jsp?tp=&arnumber=9277798&ref=,success,7cfdb2957f6c_demonstration_of_quantum_linear_equation_solver_on_the_ibm_qiskit_platform.pdf,2026-03-31T22:55:38
7d9c1f3a2af2,Achieving High-Quality Portfolio Optimization with the Variational Quantum Eigensolver,,semantic_scholar,https://arxiv.org/pdf/2508.18625.pdf,success,7d9c1f3a2af2_achieving_high_quality_portfolio_optimization_with_the_variational_quantum_eigen.pdf,2026-03-30T12:53:48
7e0bccd34042,Quantum Machine Learning methods for Fourier-based distribution estimation with application in option pricing,10.48550/arxiv.2510.19494,arxiv,https://arxiv.org/pdf/2510.19494.pdf,success,7e0bccd34042_quantum_machine_learning_methods_for_fourier_based_distribution_estimation_with_.pdf,2026-03-30T12:53:49
7e22c616ae62,Portfolio Optimization: Applications in Quantum Computing,10.1002/9781118593486.ch4,institutional,http://arxiv.org/pdf/quant-ph/0001106.pdf,mismatch,,2026-04-03T19:10:06
7e3bc9e2594c,mRNA Secondary Structure Prediction Using Utility-Scale Quantum Computers,10.1109/QCE60285.2024.00064,cached,,success,7e3bc9e2594c_mrna_secondary_structure_prediction_using_utility_scale_quantum_computers.pdf,2026-03-31T11:02:21
7e5d0a8fc172,Quadratic Speed-up in Infinite Variance Quantum Monte Carlo,,cached,,success,7e5d0a8fc172_quadratic_speed_up_in_infinite_variance_quantum_monte_carlo.pdf,2026-03-31T11:02:21
7e636e790901,Efficient DCQO Algorithm within the Impulse Regime for Portfolio Optimization,10.48550/arxiv.2308.15475,arxiv,https://arxiv.org/pdf/2308.15475.pdf,success,7e636e790901_efficient_dcqo_algorithm_within_the_impulse_regime_for_portfolio_optimization.pdf,2026-03-30T12:54:01
7ea4faff382d,Quantum Enabled-Algorithms and Market Prediction and Execution for Ultra-Low-Latency High-Frequency Trading in Global Markets,10.25397/f3ys-jj93,manual_import,,success,7ea4faff382d_quantum_enabled_algorithms_and_market_prediction_and_execution_for_ultra_low_lat.pdf,2026-04-06T16:44:35
7eefd96d7f06,Quantum algorithms for hedging and the learning of Ising models,10.1103/PhysRevA.103.012418,semantic_scholar,https://arxiv.org/pdf/2002.06003,success,7eefd96d7f06_quantum_algorithms_for_hedging_and_the_learning_of_ising_models.pdf,2026-03-30T12:54:09
7efbd5b186f9,HAT v30.2: The Unified Theory of Structural Time and the Lag Horizon,10.5281/zenodo.18161677,cached,,success,7efbd5b186f9_hat_v30_2_the_unified_theory_of_structural_time_and_the_lag_horizon.pdf,2026-03-31T11:02:26
7f0f52d2eab9,A brief review of portfolio optimization techniques,10.1007/s10462-022-10273-7,institutional,https://link-springer-com.esc-web.lib.cbs.dk/content/pdf/10.1007/s10462-022-10273-7.pdf,success,7f0f52d2eab9_a_brief_review_of_portfolio_optimization_techniques.pdf,2026-03-31T22:55:58
7f5135581c08,Financial Risk Management on a Neutral Atom Quantum Processor,10.48550/arxiv.2212.03223,arxiv,https://arxiv.org/pdf/2212.03223.pdf,success,7f5135581c08_financial_risk_management_on_a_neutral_atom_quantum_processor.pdf,2026-03-30T12:54:18
7f8c8060e256,Quantifying the advantages of applying quantum approximate algorithms to portfolio optimisation,10.1088/2058-9565/ae4a48,semantic_scholar,https://arxiv.org/pdf/2410.16265.pdf,success,7f8c8060e256_quantifying_the_advantages_of_applying_quantum_approximate_algorithms_to_portfol.pdf,2026-03-30T12:54:23
7f91dcfbca63,"Quantum-inspired anomaly detection, a QUBO formulation",,manual_import,,success,7f91dcfbca63_quantum_inspired_anomaly_detection_a_qubo_formulation.pdf,2026-04-06T13:03:29
80690e1e30a0,Real-Time Threat Mitigation in Financial IT Infrastructures Using Quantum Computing,10.24425/ijet.2025.153578,manual_import,,success,80690e1e30a0_real_time_threat_mitigation_in_financial_it_infrastructures_using_quantum_comput.pdf,2026-04-06T13:03:29
80db1bf3c910,Quantum Machine Learning for Credit Scoring,10.3390/math12091391,recovery_s2,https://arxiv.org/pdf/2308.03575.pdf,success,80db1bf3c910_quantum_machine_learning_for_credit_scoring.pdf,2026-03-31T12:46:42
81146d2c9f2a,Quantum-Enhanced Smart Computing Framework for Sustainable Credit Risk Decision Communication,10.4018/979-8-3373-3541-4.ch013,institutional,http://esc-web.lib.cbs.dk/login?url=https://doi.org/10.4018/979-8-3373-3541-4.ch013,download_failed,,2026-03-31T22:44:26
814040fcfdb1,Financial Portfolio Optimization Method Based on the Quantum Linear Discriminant Analysis,10.12178/1001-0548.2022109,manual_import,,success,814040fcfdb1_financial_portfolio_optimization_method_based_on_the_quantum_linear_discriminant.pdf,2026-04-06T16:44:35
8154d6cc12dd,Prediction of Stocks Index Price using Quantum GANs,10.1609/aaaiss.v7i1.36904,cached,,success,8154d6cc12dd_prediction_of_stocks_index_price_using_quantum_gans.pdf,2026-03-31T11:03:16
81f92de64876,Quantum-Enhanced Simulation-Based Optimization,10.1109/QCE49297.2020.00017,cached,,success,81f92de64876_quantum_enhanced_simulation_based_optimization.pdf,2026-03-31T11:03:16
822dbee7acfe,Scaling Portfolio Diversification with Quantum Circuit Cutting Techniques,,cached,,success,822dbee7acfe_scaling_portfolio_diversification_with_quantum_circuit_cutting_techniques.pdf,2026-03-31T11:03:16
82475e54c193,Quantum Encoding and Analysis on Continuous Time Stochastic Process with Financial Applications,10.22331/q-2023-10-03-1127,cached,,success,82475e54c193_quantum_encoding_and_analysis_on_continuous_time_stochastic_process_with_financi.pdf,2026-03-31T11:03:16
8248c1859e99,"Data is often loadable in short depth: Quantum circuits from tensor networks for finance, images, fluids, and proteins",10.48550/arxiv.2309.13108,arxiv,https://arxiv.org/pdf/2309.13108.pdf,success,8248c1859e99_data_is_often_loadable_in_short_depth_quantum_circuits_from_tensor_networks_for_.pdf,2026-03-30T12:55:00
8273c874208a,Alternative pipeline for option pricing using quantum computers,10.1140/epjqt/s40507-025-00328-3,cached,,success,8273c874208a_alternative_pipeline_for_option_pricing_using_quantum_computers.pdf,2026-03-31T11:03:16
83317aae0ec0,Hybrid quantum investment optimization with minimal holding period,10.1038/s41598-021-98297-x,cached,,success,83317aae0ec0_hybrid_quantum_investment_optimization_with_minimal_holding_period.pdf,2026-03-31T11:03:16
8372b98f0875,Unsupervised quantum machine learning for fraud detection,,cached,,success,8372b98f0875_unsupervised_quantum_machine_learning_for_fraud_detection.pdf,2026-03-31T11:03:16
837f13f527f7,Enhancing Quantum Federated Learning with Fisher Information-Based Optimization,10.48550/arxiv.2507.17580,arxiv,https://arxiv.org/pdf/2507.17580.pdf,success,837f13f527f7_enhancing_quantum_federated_learning_with_fisher_information_based_optimization.pdf,2026-03-30T12:55:13
845689734409,A quantum unstructured search algorithm for discrete optimisation: the use case of portfolio optimisation,10.48550/arxiv.2505.14645,arxiv,https://arxiv.org/pdf/2505.14645.pdf,success,845689734409_a_quantum_unstructured_search_algorithm_for_discrete_optimisation_the_use_case_o.pdf,2026-03-30T12:55:14
852010d3745d,Combinatorial Amplitude Patterns via Nested Quantum Affine Transformations,,cached,,success,852010d3745d_combinatorial_amplitude_patterns_via_nested_quantum_affine_transformations.pdf,2026-03-31T11:03:16
858a41cdb5b2,Quantum Arithmetic for Directly Embedded Arrays,10.3390/engproc2021007045,recovery_s2,https://arxiv.org/pdf/2107.13872.pdf,success,858a41cdb5b2_quantum_arithmetic_for_directly_embedded_arrays.pdf,2026-03-31T12:47:03
85e9109e6bb0,Financial Fraud Detection with Entropy Computing,10.48550/arXiv.2503.11273,arxiv,https://arxiv.org/pdf/2503.11273.pdf,success,85e9109e6bb0_financial_fraud_detection_with_entropy_computing.pdf,2026-03-30T12:55:23
85fbbb9f2a42,A Preprocessing Perspective for Quantum Machine Learning Classification Advantage in Finance Using NISQ Algorithms,10.3390/e24111656,recovery_s2,https://arxiv.org/pdf/2208.13251.pdf,success,85fbbb9f2a42_a_preprocessing_perspective_for_quantum_machine_learning_classification_advantag.pdf,2026-03-31T12:47:07
862fc759b55d,Alternative sampling for variational quantum Monte Carlo,10.1103/PhysRevE.77.016704,cached,,success,862fc759b55d_alternative_sampling_for_variational_quantum_monte_carlo.pdf,2026-03-31T11:03:17
86891f250a78,Quantum machine learning on near-term quantum devices: Current state of supervised and unsupervised techniques for real-world applications,10.1103/physrevapplied.21.067001,institutional,http://esc-web.lib.cbs.dk/login?url=https://doi.org/10.1103/physrevapplied.21.067001,download_failed,,2026-03-31T22:44:32
86fa1780f8fe,QUANTUM-ENHANCED RISK ASSESSMENT FOR SECURING BLOCKCHAIN-ENABLED FINANCIAL SYSTEMS AND INTERCONNECTED CYBER NETWORKS,10.34218/ijcs_01_01_006,cached,,success,86fa1780f8fe_quantum_enhanced_risk_assessment_for_securing_blockchain_enabled_financial_syste.pdf,2026-03-31T11:03:24
871c63b61487,Extracting a function encoded in amplitudes of a quantum state by tensor network and orthogonal function expansion,10.1007/s11128-023-03937-y,cached,,success,871c63b61487_extracting_a_function_encoded_in_amplitudes_of_a_quantum_state_by_tensor_network.pdf,2026-03-31T11:03:24
