paper_id,ai_decision,ai_rank,ai_confidence,reason_code,reasoning
0af1a2719764,exclude,2356,0.8000,EX-NONFIN,Paper title suggests quantum circuit behavior modeling with no finance application indicated
4b1086a49841,exclude,2357,0.8000,EX-NONFIN,The paper addresses security topics with no indication of finance applications or gate-based quantum methods.
be11414e791a,exclude,2358,0.8000,EX-NONFIN,Title lacks any indication of a financial application and no abstract is available to suggest finance relevance.
9ac554cf64c4,exclude,2359,0.8000,EX-NOMETHOD,This is a broad survey of quantum computing technologies and applications with no original finance-specific gate-based method details.
0608ad48d5b8,exclude,2360,0.8000,EX-TOOSHORT,No abstract or methodological details are available to confirm gate-based quantum computing approach and extract methodology.
30582038a7ba,exclude,2361,0.8000,EX-NONFIN,The paper proposes a quantum kernel for general anomaly detection in temporal series without a specific financial application or evaluation on finance data.
1696f0ac9e8f,include,2362,0.8000,INCLUDE,The paper applies gate-based amplitude estimation and Grover-type circuits to Monte Carlo finance problems and provides implementation details suitable for extraction.
2d0a1d7e68fe,exclude,2363,0.8000,EX-TOOSHORT,No abstract or methodological detail available to assess the quantum method and evaluation.
b810b9ed99a1,exclude,2364,0.8000,EX-NONFIN,The paper proposes a generic quantum circuit method for loading distributions without a specific financial application or use case.
797dd499ce56,exclude,2365,0.8000,EX-NONFIN,The paper provides a theoretical analysis of amplitude encoding without addressing any concrete financial application or use case.
ed8c26ba3c58,exclude,2366,0.8000,EX-NONFIN,No evidence of a financial application in the title and lacking an abstract suggests non-finance focus.
09c9e8935e0a,exclude,2367,0.8000,EX-NONFIN,Focuses on quantum algorithms for linear systems with structured matrices but no financial application mentioned
e14a83eed304,exclude,2368,0.8000,EX-NONFIN,Focuses on quantum security analysis of blockchain rather than a gate-based quantum method applied to a financial use case
6c3031bde637,exclude,2369,0.8000,EX-NOMETHOD,General survey of quantum machine learning with no novel gate-based finance application or methodological details.
a559d0de0c01,include,2370,0.8000,INCLUDE,This paper applies gate-based parametrised quantum circuits as QNNs to a finance-related time series forecasting task with sufficient methodological comparison to classical models.
49f7bc1cf5cf,exclude,2371,0.8000,EX-NONFIN,No indication of a financial application in title and no abstract available.
7a2871898d6c,exclude,2372,0.8000,EX-NOMETHOD,The submission is a tutorial overview without any original gate-based quantum method or specific financial application details.
435a5114b884,exclude,2373,0.8000,EX-NONFIN,"No evidence of a financial application, focuses solely on QFT complexity reduction"
14d183709128,exclude,2374,0.8000,EX-NONFIN,The paper addresses semiconductor physics rather than a financial application.
ac353828bbe2,exclude,2375,0.8000,EX-NONFIN,The paper focuses on GNSS authentication cryptography (TESLA) with no financial application.
837f13f527f7,exclude,2376,0.7900,EX-NONFIN,"The paper focuses on quantum federated learning applications in healthcare and image datasets, with no concrete financial application detailed."
e40a21367703,include,2377,0.7900,INCLUDE,The paper uses a gate-based variational quantum neural network for stock price prediction with sufficient methodological and evaluation detail.
2c4d289800dd,exclude,2378,0.7900,EX-NONFIN,The paper focuses on healthcare workflow scheduling rather than a finance application.
ce0d033d04f1,exclude,2379,0.7900,EX-PARADIGM,This is a broad deep learning survey with no gate-based quantum computing methodology.
7f1c3d63f9e8,include,2380,0.7900,INCLUDE,The paper proposes a gate-based hybrid quantum-classical QCBM approach for financial volatility forecasting with detailed methodology and evaluation.
1312e9d3c55e,include,2381,0.7800,INCLUDE,Paper uses hybrid gate-based quantum methods with a demonstrated portfolio optimization use case and provides sufficient methodological detail.
7f09d7df1f04,include,2382,0.7800,INCLUDE,Proposes a hybrid gate-based quantum-classical neural network applied to financial time series forecasting with sufficient methodological detail.
b58f4a78e015,exclude,2383,0.7800,EX-PARADIGM,The paper proposes an adiabatic/quantum annealing style algorithm (Q-CHOP) rather than a gate-based quantum computing approach.
e9b892fcd6fc,include,2384,0.7800,INCLUDE,Proposes a gate-based quantum neural network for credit card fraud detection with sufficient methodological detail.
1d49f2843829,exclude,2385,0.7800,EX-NOMETHOD,Abstract reads like a high-level survey without original gate-based method details or concrete methodological contributions.
26e27073cdc6,exclude,2386,0.7800,EX-NOMETHOD,The paper is a survey of quantum machine learning architectures in finance without presenting an original gate-based quantum method contribution.
51c76454c0ce,include,2387,0.7800,INCLUDE,"The paper proposes a hybrid gate-based quantum-classical deep learning approach for credit risk assessment with sufficient methodological detail for problem family, quantum method, and evaluation type."
dc622f60f6bc,exclude,2388,0.7800,EX-NOMETHOD,"No abstract or methodological details available, likely a survey chapter without original gate-based quantum finance methods."
a64a61143fdb,exclude,2389,0.7800,EX-NOMETHOD,"The paper provides a high-level survey without specific gate-based quantum algorithms, financial problem details, or methodological evaluation."
db261ea6c735,include,2390,0.7800,INCLUDE,"The paper proposes gate-based quantum ML methods (QNMF and QSVM) and evaluates them on finance datasets, providing methodological detail for extraction."
cf30c27e711a,include,2391,0.7800,INCLUDE,The paper employs a simulated gate-based quantum circuit for feature encoding in financial time series forecasting with sufficient methodological detail
9abc38e76aec,exclude,2392,0.7800,EX-NOMETHOD,This is a survey of existing quantum economics literature without presenting a novel gate-based quantum method or detailed methodology for extraction.
ccdba169348e,include,2393,0.7800,INCLUDE,Hybrid variational quantum circuit framework applied to financial rare-event prediction with sufficient methodological detail.
4bd6287860da,exclude,2394,0.7800,EX-OTHER,Paper does not propose or use a gate-based quantum computing approach.
08b3bfda37ff,exclude,2395,0.7800,EX-NOMETHOD,This is a survey/review article with no original gate-based quantum computing method contribution in finance.
f1d04d0a6e74,exclude,2396,0.7800,EX-NONFIN,The paper focuses on cybersecurity for digital transformation and does not address any financial application.
0f028fff3500,exclude,2397,0.7800,EX-TOOSHORT,No abstract or methodological detail available to determine relevance or methods.
cf9049abcad1,include,2398,0.7800,INCLUDE,"The paper proposes a hybrid AI framework incorporating gate-based quantum neural network modules for fraud detection in an online marketplace, with sufficient methodological detail."
c7679a7ea502,exclude,2399,0.7800,EX-NONFIN,The paper discusses big data analytics in audit evidence without any gate-based quantum computing method or relevant financial application.
db80198dfbe9,exclude,2400,0.7800,EX-NONFIN,The paper focuses on quantum computing in fog environments without a financial application.
d9cf2d791c87,exclude,2401,0.7700,EX-PARADIGM,The paper offers topological analogies to quantum logic gates but does not propose or use any concrete gate-based quantum computing method.
3c93fa52d7f0,exclude,2402,0.7700,EX-NONFIN,The paper proposes quantum speedups for nonreversible Markov chain sampling but does not address a specific financial application.
d7d7d3d60807,exclude,2403,0.7700,EX-NONFIN,The paper focuses on sentiment analysis in bilateral conversations without a specific finance use case or financial dataset.
43796e9e8bcd,exclude,2404,0.7700,EX-NONFIN,Paper focuses on photonic hardware for quantum computing rather than a finance-specific gate-based application
5a7fc9a445a7,exclude,2405,0.7700,EX-NONFIN,The paper presents a general hybrid QML framework for big data analytics without detailing a specific financial application or use case
646bd6bbd935,exclude,2406,0.7600,EX-NONFIN,"The paper focuses on quantum Monte Carlo for many-body physics, not a financial application."
0589931d86b4,exclude,2407,0.7600,EX-NONFIN,Paper focuses on quantum annealing for spin glass optimization without any financial application.
3e373f43ba5b,exclude,2408,0.7600,EX-NONFIN,The paper focuses on general quantum state preparation methods and does not address a specific financial application or use case.
0030bd185e0d,include,2409,0.7600,INCLUDE,The study integrates gate-based quantum-enhanced optimization within a financial risk modeling framework and provides sufficient methodological and evaluative details.
cf14d9567612,exclude,2410,0.7600,EX-PARADIGM,The paper focuses on a quantum-inspired classical tensor-network approach with no gate-based quantum computing methods.
a146932846fb,exclude,2411,0.7600,EX-NOMETHOD,The paper is a broad survey of applied mathematics trends with no original gate-based quantum computing method or specific financial application detailed.
b9793b3d8619,include,2412,0.7600,INCLUDE,Uses quantum amplitude estimation (a gate-based algorithm) for option pricing and provides sufficient methodological detail on the photonic implementation for a financial use case.
479092dfcc1c,exclude,2413,0.7500,EX-NONFIN,The paper focuses on generic quantum measurement cost reduction for VQE and does not address a specific financial application or use case.
a2af699e0cea,exclude,2414,0.7500,EX-NOMETHOD,This is a survey/review without novel method contribution.
631717352091,include,2415,0.7500,INCLUDE,"Proposes a gate-based quantum algorithm for Monte Carlo option pricing, a financial application with novel methodological details."
6ce12ea7c2bf,exclude,2416,0.7500,EX-PARADIGM,The finance application (credit feature selection) uses only quantum annealing without any gate-based quantum method applied to the financial task.
596d3496c56c,include,2417,0.7500,INCLUDE,"Proposes a gate-based quantum architecture search method and demonstrates it on finance benchmarks, providing sufficient methodological detail."
342ce43a11d1,include,2418,0.7500,INCLUDE,The paper proposes a gate-based Quantum Monte Carlo algorithm for bank stress testing and macroeconomic models with detailed circuit formulations and benchmarking.
7a47e22ecc89,exclude,2419,0.7500,EX-PARADIGM,The paper frames a QUBO benchmark without specifying or applying a gate-based quantum computing algorithm.
f85bdc99d9eb,exclude,2420,0.7500,EX-NOMETHOD,This is a survey paper with no original methodological contribution.
798667d343b2,include,2421,0.7500,INCLUDE,The paper uses a gate-based quantum machine learning approach implemented on TensorFlow Quantum for a credit scoring financial application with sufficient methodological detail.
881dd9b94148,exclude,2422,0.7500,EX-PARADIGM,The paper exclusively employs quantum annealing (D-Wave) rather than gate-based quantum computing.
9405b3330b09,exclude,2423,0.7500,EX-NONFIN,"The paper does not specify a concrete financial use case, only vague continuous variable prediction without a defined finance application."
8248c1859e99,exclude,2424,0.7500,EX-OTHER,The paper focuses on a general quantum data-loading method evaluated on financial datasets but does not address a specific financial application or problem family.
36432eaf1f31,include,2425,0.7500,INCLUDE,The paper applies a discrete-time quantum walk gate-based method to a financial application with sufficient methodological description.
4f6d203f9c8b,exclude,2426,0.7500,EX-NONFIN,The paper applies quantum machine learning to synthetic geometric classification tasks and does not present a concrete financial application use case.
871c63b61487,include,2427,0.7500,INCLUDE,"Proposes a gate-based quantum circuit method and demonstrates it on a finance-motivated function, satisfying all criteria."
ce4543302c65,exclude,2428,0.7500,EX-NONFIN,Paper focuses on Hubbard model quantum simulation without any financial application
0a96ec74c59f,include,2429,0.7500,INCLUDE,Uses QAOA (gate-based) for a financial application (predicting financial crashes) with methodological benchmarking details.
cfc22a0f0b6b,exclude,2430,0.7500,EX-NONFIN,The paper proposes a quantum-walk-based time-series model without a specific financial application or evaluation on financial data.
5d534083c368,exclude,2431,0.7500,EX-NONFIN,"The paper does not apply its hybrid quantum-classical algorithm to a specific financial use case, focusing only on generic combinatorial problems."
363e6edfe7ec,exclude,2432,0.7500,EX-NONFIN,The paper discusses quantum data encoding theory without addressing a specific financial application or use case.
f278e6cdca0b,exclude,2433,0.7500,EX-NOMETHOD,This is a review survey paper with no original gate-based quantum computing method contribution
f3fef9d7c4c9,exclude,2434,0.7500,EX-NONFIN,This paper addresses a condensed matter physics spin-orbital model and contains no financial application
7f91dcfbca63,exclude,2435,0.7500,EX-NONFIN,Paper does not focus on a specific financial use case.
ebc26d3b1089,exclude,2436,0.7500,EX-NONFIN,"This is an empirical software engineering study of quantum programming patterns, not a gate-based quantum solution to a specific finance problem."
218efe20a747,exclude,2437,0.7500,EX-PARADIGM,The paper uses a quantum annealer activation rather than a gate-based quantum computing approach.
2de072636285,exclude,2438,0.7500,EX-NONFIN,The paper proposes a general quantum state preparation algorithm without a concrete financial application or use case.
fea476c8c499,include,2439,0.7500,INCLUDE,Paper proposes quantum machine learning methods (quantum DPP and QNN architectures) applied to financial forecasting and credit risk with methodological details.
7e22c616ae62,exclude,2440,0.7500,EX-PARADIGM,The chapter focuses on adiabatic quantum computation (quantum annealing) without any gate-based quantum computing methods.
54a318e50e8a,exclude,2441,0.7500,EX-NOMETHOD,This paper is a systematic review without original gate-based quantum finance method contributions.
a4c29a22413b,include,2442,0.7500,INCLUDE,"Title indicates a gate-based hybrid quantum-classical method applied to option pricing and sensitivities, satisfying inclusion criteria."
a19de5d705c8,exclude,2443,0.7500,EX-TOOSHORT,"No abstract or content provided, so there is insufficient methodological detail to assess inclusion criteria."
64111b3b5d61,exclude,2444,0.7500,EX-NOMETHOD,This book provides a broad survey of emerging technologies with no original gate-based quantum computing methods or sufficient methodological detail.
23e03dc57b20,exclude,2445,0.7500,EX-NOMETHOD,The paper reports computational results for an algorithm described elsewhere without providing sufficient methodological detail to extract the problem family or quantum method.
2c5b14974d41,exclude,2446,0.7500,EX-NOMETHOD,The paper presents a classical decomposition pipeline without specifying or detailing any concrete gate-based quantum algorithm or implementation.
9242f9c3e9d3,include,2447,0.7500,INCLUDE,Proposes a hybrid quantum-classical variational circuit approach for fraud detection in finance with sufficient methodological detail.
c759041ceebc,include,2448,0.7500,INCLUDE,This paper proposes a gate-based quantum SVM model for financial market prediction with detailed methodology and evaluation.
0040bbb631e7,exclude,2449,0.7500,EX-NOMETHOD,This paper is a survey/tutorial without original method contribution or a concrete financial application.
0128a49a10cc,include,2450,0.7500,INCLUDE,"The paper proposes gate-based quantum algorithms (quantum linear systems, quantum simplex) for derivative pricing in finance with sufficient methodological detail."
78b97b2dbd8e,include,2451,0.7500,INCLUDE,Proposes a gate-based quantum neural network applied to finance (stock price prediction) with sufficient methodological details.
6257d900d3ef,include,2452,0.7500,INCLUDE,The paper proposes a gate-based Quantum SVM for cross-border financial fraud detection with sufficient methodological detail on circuits and evaluation metrics.
72ebec30faa2,exclude,2453,0.7500,EX-NONFIN,Paper is general quantum algorithm improvement with only a mention of potential finance applications without addressing any specific financial use case.
d746904e8cbb,exclude,2454,0.7500,EX-NONFIN,The paper focuses on NLP text classification rather than a financial application.
b0b91099e62b,exclude,2455,0.7500,EX-PARADIGM,The paper uses purely deep learning models with no gate-based quantum computing methods.
30c35313cb34,include,2456,0.7500,INCLUDE,"The paper applies gate-based quantum algorithms (e.g., QAOA) to portfolio optimization in finance and provides sufficient methodological detail for problem family, quantum method, and evaluation type."
615067f0066c,exclude,2457,0.7500,EX-PARADIGM,The method relies on quantum annealing rather than a gate-based quantum computing approach
3ef4b532205f,exclude,2458,0.7500,EX-NOMETHOD,This is a survey chapter without original methodological contributions focusing broadly on quantum machine learning rather than a specific finance application.
7f31a79182b8,exclude,2459,0.7500,EX-NOMETHOD,Chapter is a broad survey without original gate-based quantum method contributions or sufficient methodological detail.
cbc953d2f213,include,2460,0.7500,INCLUDE,Proposes gate-based quantum ML methods for fraud detection—a financial use case—with sufficient methodological detail for extraction.
11807719b419,exclude,2461,0.7500,EX-NOMETHOD,The paper provides a resource analysis of an existing quantum algorithm without proposing a new gate-based method or original financial application.
40ca827d69b9,include,2462,0.7500,INCLUDE,Proposes a quantum-assisted RBM method (a hybrid gate-based quantum-classical approach) for fraud detection in finance with sufficient methodological detail.
fd31c17753a0,include,2463,0.7500,INCLUDE,The paper proposes a hybrid quantum-classical (quantum optimization) method for a financial fraud detection application with sufficient methodological and evaluation detail.
90c94d9959ea,exclude,2464,0.7500,EX-TOOSHORT,No abstract or methodological detail is available to assess inclusion criteria.
a0d2cf9e49bf,exclude,2465,0.7500,EX-NONFIN,Abstract presents a generic distributed quantum optimization framework without a specific finance application or detailed financial use case
468c3327bdef,exclude,2466,0.7500,EX-NOMETHOD,The paper provides a high-level survey on quantum computing for fraud detection without proposing or detailing a specific gate-based quantum method.
64beee021f17,include,2467,0.7500,INCLUDE,Presents a hybrid quantum-classical (gate-based) network applied to a financial data classification task with methodological details.
2dd59afb46ba,exclude,2468,0.7500,EX-PARADIGM,This paper uses a quantum-inspired classical optimization model rather than a gate-based quantum computing approach.
46e6281cc0ea,include,2469,0.7500,INCLUDE,The paper proposes a gate-based quantum feature selection method with Hamiltonian encoding and ground state preparation and evaluates it on finance datasets.
933bdafb118d,exclude,2470,0.7500,EX-TOOSHORT,No abstract or methodological details are available to confirm a gate-based quantum finance application.
f52ccbadc200,exclude,2471,0.7500,EX-NONFIN,The paper describes a general quantum programming tool with no specified financial application.
ea49de660a56,exclude,2472,0.7500,EX-NONFIN,The paper is a non-finance survey of machine learning/deep learning without any gate-based quantum computing component.
1bc4675bdbc6,exclude,2473,0.7500,EX-NONFIN,The paper describes a discrete-time quantum walk with a Bose-Einstein condensate in momentum space without any specific financial application
7e35863af0de,exclude,2474,0.7500,EX-NONFIN,The paper focuses on cybersecurity and wireless communications rather than any finance application.
f765def9a79b,exclude,2475,0.7500,EX-PARADIGM,The paper is a classical machine learning survey with no gate-based quantum computing content.
f04832263658,exclude,2476,0.7500,EX-PARADIGM,The paper employs a quantum-inspired classical framework without any gate-based quantum computing component.
796fa13a8187,exclude,2477,0.7500,EX-PARADIGM,The paper discusses quantum-inspired neural networks and conceptual QML without proposing or using any gate-based quantum computing approaches.
46747251da24,exclude,2478,0.7500,EX-NONFIN,The paper does not propose or use any gate-based quantum computing approach in finance.
d2fc456ed2ef,exclude,2479,0.7500,EX-PARADIGM,The paper focuses on post-quantum cryptography methods rather than a gate-based quantum computing approach in a financial application.
e4cc3a4835ea,include,2480,0.7500,INCLUDE,"The paper demonstrates gate-based hybrid quantum-classical methods with a finance use case (portfolio optimization) and provides concrete methodological details for problem, quantum method, and evaluation."
245d972a3509,exclude,2481,0.7500,EX-NOMETHOD,This is a broad hardware survey/book with no original finance-specific quantum method details.
a41cce27e041,exclude,2482,0.7500,EX-NOMETHOD,This is a broad systematic review without original gate-based quantum computing methods or sufficient methodological detail on quantum finance applications.
9ecabb9df454,exclude,2483,0.7500,EX-PARADIGM,The paper focuses on quantum annealing and counterdiabatic evolution without proposing any gate-based quantum computing methods.
6ddfa1f3003e,exclude,2484,0.7500,EX-NONFIN,Paper focuses on student learning of disruptive technologies rather than gate-based quantum methods for financial applications.
ab5e4dc7468c,exclude,2485,0.7500,EX-NOMETHOD,This paper is a systematic review with no original gate-based quantum finance method contribution
f1c50105f0ee,exclude,2486,0.7500,EX-PARADIGM,The paper formulates portfolio optimization as a QUBO for quantum annealing or hybrid solvers without employing a gate-based quantum computing approach.
4ba77737095e,exclude,2487,0.7500,EX-NONFIN,This paper focuses on post-quantum cryptography for cybersecurity rather than gate-based quantum methods applied to finance.
d2bec1f37aca,exclude,2488,0.7500,EX-NOMETHOD,The paper is a broad survey without original gate-based quantum method contributions or detailed methodological content specific to finance.
559b94bd12c0,exclude,2489,0.7500,EX-NOMETHOD,This is a broad survey paper without original method contributions or detailed methodology for finance applications.
1d17b4f1d1c8,exclude,2490,0.7500,EX-TOOSHORT,"No abstract or detailed content provided, insufficient information to assess criteria."
b193d72aab07,exclude,2491,0.7500,EX-NONFIN,The paper focuses on FPGA-based simulation of QAOA without addressing a specific financial application.
0302fce8406e,exclude,2492,0.7500,EX-NOMETHOD,"This is a survey/guide volume without original method contributions focused broadly on QML, not specific gate-based finance applications."
356fe5baf984,exclude,2493,0.7500,EX-NONFIN,The paper focuses on quantum key distribution and secure image transmission with no financial application
379bb44b511e,include,2494,0.7500,INCLUDE,Proposes gate-based quantum algorithms for second-order cone programming with portfolio optimization application and sufficient methodological detail.
3d2d9f76fa1f,exclude,2495,0.7500,EX-TOOSHORT,No abstract or methodological detail available to assess finance relevance or gate-based approach.
770956b6f34d,exclude,2496,0.7500,EX-NOMETHOD,This is a survey of QML algorithms with no original method contribution or detailed finance application.
84fd2c94fbde,exclude,2497,0.7500,EX-PARADIGM,The paper discusses classical AI/ML for portfolio management without any gate-based quantum computing methods.
115e509ec529,include,2498,0.7500,INCLUDE,Proposes a hybrid gate-based quantum-classical approach for financial market prediction with methodological details on the quantum circuit architecture
ed02e34c2236,exclude,2499,0.7500,EX-NOMETHOD,This is a general introductory survey without original quantum-finance methods or sufficient methodological detail.
2b847e394979,exclude,2500,0.7500,EX-TOOSHORT,No abstract or methodological detail is available to assess the quantum-classical approach in a finance application.
dba77b2d242c,exclude,2501,0.7500,EX-NOMETHOD,The paper is a broad survey chapter without original quantum gate-based finance methods or sufficient methodological detail.
455f0fa41521,include,2502,0.7500,INCLUDE,Proposes a hybrid gate-based quantum convolutional neural network with PSO for a financial data analysis application with detailed performance metrics.
59f77924ebc2,exclude,2503,0.7500,EX-TOOSHORT,No abstract or content available to assess methodological details
2cc81e9e3599,exclude,2504,0.7500,EX-NOMETHOD,The paper is a broad conceptual survey with no specific gate-based quantum method or detailed financial application methodology provided.
2f0fa544425a,exclude,2505,0.7500,EX-NONFIN,Focuses on quantum-secured blockchain cryptography rather than a finance-specific calculation or optimization application
96afa48cba5f,exclude,2506,0.7500,EX-PARADIGM,The paper uses quantum-inspired annealing principles in a classical AI framework rather than a gate-based quantum computing approach.
aeea7580b6f5,exclude,2507,0.7500,EX-PARADIGM,"The paper does not propose or use any gate-based quantum computing method, only classical AI and blockchain approaches."
