paper_id,ai_decision,ai_rank,ai_confidence,reason_code,reasoning
624a4d090c3e,exclude,788,0.9000,EX-NONFIN,The paper focuses on classical cryptographic schemes and does not involve gate-based quantum computing or a financial application.
7594aa350335,exclude,789,0.9000,EX-NOMETHOD,The paper is a high-level survey/analysis without any original gate-based quantum computing method or detailed methodology for finance applications.
976207a6400b,exclude,790,0.9000,EX-NOMETHOD,Paper is a historical survey without original gate-based quantum methods or detailed finance applications.
e513378d8c92,exclude,791,0.9000,EX-NOMETHOD,This is a survey/review article synthesizing existing QNN methods for e-commerce without presenting a novel methodological contribution.
944a78c8c988,exclude,792,0.9000,EX-PARADIGM,The paper discusses classical machine learning methods without any gate-based quantum computing approach.
da48095bcac8,include,793,0.9000,INCLUDE,Proposes a gate-based quantum Monte Carlo integration method for BSDEs in financial derivatives pricing with detailed methodology.
b2aee36cc033,exclude,794,0.9000,EX-NONFIN,The paper focuses on AI-driven storage migration techniques rather than any gate-based quantum computing approach applied to finance.
ea56ce8dce2b,exclude,795,0.9000,EX-NONFIN,"Paper focuses on Max-Cut graph optimization, not a financial application."
885ebde45ec5,exclude,796,0.9000,EX-NONFIN,"The paper addresses quantum cybersecurity and legal frameworks, not a finance application."
82d10e9e2eb0,exclude,797,0.9000,EX-NOMETHOD,The chapter is a survey of QML evaluation practices without proposing a novel gate-based quantum finance method.
e024cbc42148,exclude,798,0.9000,EX-PARADIGM,Paper discusses classical AI/ML in banking without proposing any gate-based quantum computing approach.
32f23740c07f,include,799,0.9000,INCLUDE,Paper uses a gate-based QAOA approach for a carbon credit portfolio optimization financial application and provides sufficient methodological details.
3da861e7eb53,include,800,0.9000,INCLUDE,Proposes a hybrid gate-based quantum self-attention model for AMM rebalancing in finance with sufficient methodological detail.
30e59e1bf93e,exclude,801,0.9000,EX-NONFIN,"The paper addresses neocortical statistical mechanics, not a financial application."
f2dcca4d90cd,exclude,802,0.9000,EX-NONFIN,This is a conference preface with no finance application or gate-based quantum computing method details.
978c511d611a,exclude,803,0.9000,EX-NONFIN,The paper focuses on web cryptography for security and privacy without gate-based quantum methods or financial applications.
1741b5307653,exclude,804,0.9000,EX-NONFIN,The paper addresses phishing detection using DOM analysis and does not involve quantum computing or a financial application.
d2a3e652a32c,exclude,805,0.9000,EX-NOMETHOD,This is a general survey/review paper with no original gate-based quantum computing method contribution in finance
f5f1ac805656,exclude,806,0.9000,EX-NONFIN,The title indicates a general quantum machine learning primer with no finance-specific application described.
2849bbcb864e,include,807,0.9000,INCLUDE,Presents a gate-based quantum neural network for credit-risk assessment with detailed methodology and evaluation on real-world data.
e13c1293dd99,exclude,808,0.9000,EX-PARADIGM,The paper employs deep learning methods without any gate-based quantum computing component.
34d4f9d054a5,exclude,809,0.9000,EX-PARADIGM,The paper focuses on post-quantum cryptographic schemes rather than gate-based quantum computing methods in finance.
3150f16bb064,exclude,810,0.9000,EX-NONFIN,The paper studies quantum walks on graphs without any finance-related application or use case.
e68890c1f564,exclude,811,0.9000,EX-NOMETHOD,The paper is a survey of existing literature with no original gate-based quantum finance method contribution.
b42fac5de917,exclude,812,0.9000,EX-PARADIGM,The paper uses multi-agent LLMs without any gate-based quantum computing component.
056386eb349e,exclude,813,0.9000,EX-NONFIN,Paper is a general perspective on quantum computing hype with no specific financial application.
eaf6553d5bb8,exclude,814,0.9000,EX-OTHER,The paper discusses general AI in finance with no indication of gate-based quantum computing methods.
09bb55cd5c9c,exclude,815,0.9000,EX-PARADIGM,Paper only discusses classical big data analytics without any gate-based quantum computing approaches.
ab70b7904ad3,exclude,816,0.9000,EX-NOMETHOD,This white paper is a high-level guide without original quantum finance methods or sufficient methodological details.
9aeaa0789188,exclude,817,0.9000,EX-NONFIN,"Paper does not address any financial application, focusing instead on ontology and physics."
9c6c58cb3936,exclude,818,0.9000,EX-PARADIGM,Paper focuses on deep learning for algorithmic trading with no gate-based quantum computing methods.
4b8c96036021,exclude,819,0.9000,EX-NONFIN,Focuses on chemical engineering optimization and does not address any financial application.
c8da28c1c8fb,exclude,820,0.9000,EX-NONFIN,Paper focuses on silicon spin qubit hardware development without any financial application or use case.
facfbb52d1c8,exclude,821,0.9000,EX-NONFIN,The paper addresses enterprise travel procurement optimization rather than a financial application domain
0d5a81f0f961,exclude,822,0.9000,EX-NOMETHOD,This is a high-level tutorial/survey with no original gate-based method or finance-specific methodological details.
270d264b98f3,include,823,0.9000,INCLUDE,The paper proposes a gate-based quantum approach for option risk assessment in finance with sufficient methodological detail and evaluation results.
ccd91976053c,exclude,824,0.9000,EX-NONFIN,"The paper is a broad overview across AI, quantum computing, blockchain, and RL without any focus on financial applications."
e71143fc75ea,include,825,0.9000,INCLUDE,The paper proposes a QAOA-based quantum optimization method for a financial arbitrage problem with sufficient methodological detail.
928030ce4764,exclude,826,0.9000,EX-TOOSHORT,No abstract or methodological details provided to assess inclusion criteria
5c7b09ea0999,exclude,827,0.9000,EX-NOMETHOD,The paper provides only high-level theoretical typologies without specific gate-based quantum computing methods or detailed financial application methodology.
100335736ba1,exclude,828,0.9000,EX-NOMETHOD,This is a broad survey paper without original method contributions or sufficient methodological detail.
df5489e3b780,exclude,829,0.9000,EX-NONFIN,The paper focuses on continuous-variable quantum clustering in machine learning without any financial application.
4df5d80af389,exclude,830,0.9000,EX-NOMETHOD,It’s a survey with no original finance-focused gate-based quantum method contribution
a0487a8b3542,exclude,831,0.9000,EX-NONFIN,"The paper focuses on industrial IoT and machine learning for process improvement, unrelated to finance or quantum computing."
ce6a710c1bd4,exclude,832,0.9000,EX-NONFIN,"The paper does not address any financial application, focusing instead on public health and longevity innovation."
6f1b03c4209a,exclude,833,0.9000,EX-OTHER,The paper discusses distributed data processing in finance without proposing or using any gate-based quantum computing approach.
deca35659719,include,834,0.9000,INCLUDE,The paper applies gate-based QAOA to the financial problem of portfolio optimization with sufficient methodological detail.
2ab8b7117720,exclude,835,0.9000,EX-PARADIGM,"The paper relies solely on quantum annealing, which is not a gate-based quantum computing approach."
b80223eb276b,exclude,836,0.9000,EX-NONFIN,General introduction to quantum computing with no financial application.
839960bb489b,exclude,837,0.9000,EX-NONFIN,The paper focuses on email spam classification rather than a financial application.
c9192adabf77,exclude,838,0.9000,EX-NONFIN,Paper focuses on cybersecurity rather than a financial application
98b73cdcc6a5,exclude,839,0.9000,EX-NONFIN,The paper discusses ICT and Industry 4.0 broadly without any gate-based quantum computing methods or finance application
48fc0e04ac90,exclude,840,0.9000,EX-PARADIGM,The paper presents a purely quantum-inspired classical algorithm without any gate-based quantum computing component.
013c62b365f6,exclude,841,0.9000,EX-NOMETHOD,This is a broad survey of Quantum AI with no original gate-based method contributions or sufficient methodological detail.
9aa12f0cd9d5,exclude,842,0.9000,EX-NOMETHOD,The paper is a general survey of machine learning in finance without proposing or detailing any gate-based quantum computing methods.
2cec53ded6db,exclude,843,0.9000,EX-NOMETHOD,The paper is a broad overview survey with no specific gate-based quantum computing method or methodological details.
3f8ab7317ca4,include,844,0.9000,INCLUDE,The paper proposes a gate-based QAOA extrapolation method and applies it to portfolio optimization with sufficient methodological detail.
b00a37a6d123,exclude,845,0.9000,EX-NOMETHOD,The paper is a mixed-methods review without original gate-based quantum computing methods or sufficient methodological detail for extraction.
e58ac4c8c6aa,exclude,846,0.9000,EX-NOMETHOD,The abstract is a broad preface without any specific gate-based quantum method or detailed methodology for a financial application.
604865813918,exclude,847,0.9000,EX-NONFIN,The paper focuses on extended reality in cardiac surgery for LMICs and contains no gate-based quantum computing or finance application.
0d4d912721cf,exclude,848,0.9000,EX-NONFIN,"Paper focuses on physics models (Ising, XXZ) and ansatz design without any financial application."
28de66c89497,exclude,849,0.9000,EX-NONFIN,The paper applies quantum annealing to chemical kinetics in pollutant transport models without any financial application.
1bf5fc02b95b,include,850,0.9000,INCLUDE,"The paper proposes a gate-based quantum autoencoder for financial fraud detection and provides methodological details on architectures, entanglement schemes, and evaluation."
7600a952f76a,exclude,851,0.9000,EX-NONFIN,"The paper applies gate-based QAOA to vehicle routing (a logistics problem), not a financial application."
01ad6d5b23f4,exclude,852,0.9000,EX-PARADIGM,"The paper focuses on a QUBO approach evaluated on quantum annealers only, with no gate-based quantum computing methods."
fbb3d213466e,exclude,853,0.9000,EX-NOMETHOD,No gate-based quantum computing methodology or financial application is proposed; it is a business news announcement.
b65baa1ec1b2,exclude,854,0.9000,EX-OTHER,The paper is a conceptual finance risk management study with no gate-based quantum computing methods described.
8d58112a9617,exclude,855,0.9000,EX-PARADIGM,The work uses quantum-inspired simulated annealing without any gate-based quantum computing method.
e7605c3ece00,exclude,856,0.9000,EX-NONFIN,The paper focuses on ophthalmology and healthcare applications rather than a financial use case.
bb90f72ad3ad,exclude,857,0.9000,EX-NONFIN,"Paper focuses on quantum-resistant cryptography in cybersecurity, not on any financial application."
e18cc771540e,exclude,858,0.9000,EX-NONFIN,Title indicates a policy agenda for Brazilian science and technology and not a finance-related gate-based quantum computing application.
15c38315a94c,exclude,859,0.9000,EX-PARADIGM,No gate-based quantum computing approach is used or proposed in the paper.
8d50523258ba,exclude,860,0.9000,EX-OTHER,The paper does not involve any gate-based quantum computing methods or proposals.
879b52bf6e4f,exclude,861,0.9000,EX-PARADIGM,"The paper uses classical AI/ML and blockchain for fraud detection with only a brief introduction to quantum computing, offering no gate-based quantum computing methods."
461da150d7a1,exclude,862,0.9000,EX-NONFIN,"The paper focuses on cryptography and cybersecurity with quantum computing, not on finance applications."
789d3c41741b,exclude,863,0.9000,EX-NONFIN,The paper is a general commentary on information and energy consumption with no finance application or gate-based quantum computing method described.
ec0c673bb648,exclude,864,0.9000,EX-OTHER,"The paper lacks any quantum computing methodology, focusing solely on fintech and sustainability without quantum components."
5ce743f32591,exclude,865,0.9000,EX-NONFIN,The paper discusses commercialization challenges for quantum startups rather than presenting a gate-based quantum computing application in finance.
4dc6746d80a2,exclude,866,0.9000,EX-NONFIN,The paper studies theoretical quantum walks without any financial application.
475c265e68ec,exclude,867,0.9000,EX-NOMETHOD,This is a literature review of FinTech innovations with no original gate-based quantum method or detailed methodology for finance applications.
7828e4360947,exclude,868,0.9000,EX-NOMETHOD,This concluding chapter provides no original gate-based quantum computing method details or financial application methodology.
3f1c79def1a8,exclude,869,0.9000,EX-NONFIN,"Focuses on cryptographic security and quantum-safe measures, not a financial application."
b044481aa3a1,exclude,870,0.9000,EX-NONFIN,"The paper applies quantum-enhanced anomaly detection to gas sensor monitoring, not a financial use case."
e0528d11e61f,exclude,871,0.9000,EX-NONFIN,Focuses on eCommerce and digital trade ecosystems rather than a financial application in gate-based quantum computing.
391f50f8c3f0,include,872,0.9000,INCLUDE,Presents a gate-based quantum circuit Born machine applied to portfolio optimization in finance with sufficient methodological detail.
33cd15cda848,exclude,873,0.9000,EX-NOMETHOD,The paper provides a high-level institutional analysis without proposing or detailing any gate-based quantum computing method or financial use-case implementation.
1db91a1ee5dc,exclude,874,0.9000,EX-PARADIGM,The paper uses a quantum-inspired classical algorithm rather than a gate-based quantum computing approach.
5ecd00bcafef,exclude,875,0.9000,EX-PARADIGM,Focuses on post-quantum cryptography rather than any gate-based quantum computing method
436e2c07083e,exclude,876,0.9000,EX-PARADIGM,"The paper does not propose any gate-based quantum computing methods, focusing instead on fintech and green finance innovations without quantum details."
c4c9722feca0,exclude,877,0.9000,EX-NONFIN,The title indicates a multiparty quantum cryptographic protocol for set operations with no finance application.
5a37fc259055,exclude,878,0.9000,EX-NONFIN,"The paper addresses network capacity expansion for microgrid models in energy systems, not a financial application."
66ea62f9e036,exclude,879,0.9000,EX-NONFIN,The paper focuses on a quantum-inspired algorithm for MIS in software engineering and does not address any financial application.
e7f7067531cf,exclude,880,0.9000,EX-NONFIN,"The paper focuses on applications of quantum computing in surgery and urology, not finance."
82121aee97dd,exclude,881,0.9000,EX-NOMETHOD,This paper is a broad survey with no original financial gate-based quantum computing method or sufficient methodological detail.
b7e74c4d86c4,exclude,882,0.9000,EX-PARADIGM,The paper focuses exclusively on classical hybrid cryptographic algorithms with no gate-based quantum computing component.
24e78fd643e4,exclude,883,0.9000,EX-PARADIGM,Paper does not propose or use any gate-based quantum computing approach in its financial security analysis.
8289cf07ede2,exclude,884,0.9000,EX-NONFIN,"Paper focuses on quantum authentication and key agreement in cloud domains, not financial applications."
7fbd1cbbbd8a,exclude,885,0.9000,EX-TOOSHORT,Abstract contains only buzzwords with no methodological detail.
42a0dd116b78,exclude,886,0.9000,EX-TOOSHORT,Abstract consists only of disconnected buzzwords with no methodological detail or substantive content.
9e6703aa47de,exclude,887,0.9000,EX-PARADIGM,The paper uses classical Catboost models with no gate-based quantum computing approach.
7233a0dab2a8,exclude,888,0.9000,EX-NONFIN,The paper focuses on supply chain optimization rather than a financial application.
c1a2774519a4,exclude,889,0.9000,EX-PARADIGM,The paper focuses on quantum cryptography (QKD) rather than gate-based quantum computing for financial applications.
febd4bc8234f,exclude,890,0.9000,EX-NONFIN,The paper focuses on blind quantum computing and sustainable architectures without any financial application.
b6dbc2442475,exclude,891,0.9000,EX-NONFIN,Paper focuses on AI in civil engineering without any financial application.
6a0352d909a7,exclude,892,0.9000,EX-PARADIGM,"The paper describes a classical GPU-based, quantum-inspired Ising solver (parallel tempering) without any gate-based quantum computing component."
bd93bcad0951,exclude,893,0.9000,EX-NONFIN,This is a multidisciplinary cybersecurity review without original gate-based quantum computing methods or a specific finance application.
089c6f24ca0d,exclude,894,0.9000,EX-PARADIGM,The paper only qualitatively mentions emerging quantum computing without proposing or using a gate-based quantum computing approach in a financial application.
2e5014bfdc69,exclude,895,0.9000,EX-OTHER,The paper does not use or propose any gate-based quantum computing approach.
e0b9e3478040,exclude,896,0.9000,EX-NONFIN,"The paper focuses on AI applications in civil engineering, not finance or gate-based quantum computing."
87fc6fac0126,exclude,897,0.9000,EX-OTHER,The paper title indicates an AI-based encryption system with no evidence of gate-based quantum computing content.
b6b818970241,exclude,898,0.9000,EX-NONFIN,The paper focuses on quantum cryptography for cybersecurity rather than a financial application.
130e57f7f90b,exclude,899,0.9000,EX-NONFIN,This paper is an empirical study on employee satisfaction and digital transformation with no gate-based quantum computing methods or finance applications.
ee8df98c29e5,exclude,900,0.9000,EX-PARADIGM,"The paper focuses on lattice-based post-quantum cryptography for secure DLT, not on gate-based quantum computing applications in finance."
8ddc45d8d56c,exclude,901,0.9000,EX-NONFIN,The paper addresses AGI governance and contains no gate-based quantum finance application.
6b6c749e0c74,exclude,902,0.9000,EX-PARADIGM,Focuses on quantum-resistant classical cryptography rather than gate-based quantum computing methods.
83acd7a49f68,exclude,903,0.9000,EX-PARADIGM,No indication of any gate-based quantum computing approach in the paper title or abstract
058aea91eb1d,exclude,904,0.9000,EX-NONFIN,This is a broad business survey without a specific financial gate-based quantum computing application or methodological detail.
6682f67e2c33,exclude,905,0.9000,EX-NONFIN,The paper does not address a financial application and focuses on general quantum and biocomputing operations.
5700da3cc74d,exclude,906,0.9000,EX-NONFIN,The paper focuses on digital health screening for mild cognitive impairment and does not involve quantum computing or financial applications.
52c140372850,exclude,907,0.9000,EX-PARADIGM,"The paper focuses on coherent Ising machines, an analog quantum annealing platform, without gate-based quantum computing methods."
7471e3f6b2cb,exclude,908,0.9000,EX-NOMETHOD,This is a broad survey of quantum computing with no specific financial application methodology or original gate-based contribution detailed.
1ac1b7a5c545,exclude,909,0.9000,EX-PARADIGM,The paper focuses on quantum-resistant classical cryptography for blockchain rather than gate-based quantum computing.
a078d0fc9b31,exclude,910,0.9000,EX-NONFIN,The paper focuses on quantum cryptography and AI for security without addressing any financial application.
25f81312b76c,exclude,911,0.9000,EX-NOTEN,The paper is not in English and does not present an original gate-based quantum finance method.
97ad821bcd14,exclude,912,0.9000,EX-NONFIN,The paper does not address any financial application but rather focuses on metaphysical posthumous deification experiments.
a3a5f4b6652a,exclude,913,0.9000,EX-NOMETHOD,The paper is a conceptual risk management article with no gate-based quantum computing methods or detailed quantum-finance methodology.
4cdfe261571c,exclude,914,0.9000,EX-PARADIGM,The paper develops a theoretical econophysics framework without proposing or employing any gate-based quantum computing methods.
6b1e07ccfd3b,exclude,915,0.9000,EX-NONFIN,The paper does not propose any gate-based quantum computing methods nor a specific financial quantum application.
3b95c849f680,exclude,916,0.9000,EX-NONFIN,Abstract does not address any specific financial application.
b1ac2664cd53,exclude,917,0.9000,EX-NOMETHOD,This is a survey of intelligent payment systems with no gate-based quantum computing method or original quantum contribution.
f537384ed614,exclude,918,0.9000,EX-NONFIN,Paper does not involve any quantum computing methods nor a financial application.
69aebd129f63,exclude,919,0.9000,EX-OTHER,Paper addresses longevity risk and capital markets with no gate-based quantum computing content
eff6941ff4bf,exclude,920,0.9000,EX-NONFIN,The paper is a policy analysis of China’s Digital Silk Road rather than a gate-based quantum computing application in a financial context.
082de7b377fe,exclude,921,0.9000,EX-NOMETHOD,This is a broad survey of quantum engineering across multiple domains with no original gate-based quantum method contribution in finance.
0c968a9296b2,exclude,922,0.9000,EX-NONFIN,Focuses on post-quantum cryptography for payment security rather than gate-based quantum computing methods for financial problem-solving.
bfa36f6cd6ac,exclude,923,0.9000,EX-OTHER,The paper does not propose or use any gate-based quantum computing approach.
789b7d831f66,exclude,924,0.9000,EX-NOMETHOD,The paper is a theoretical policy study mentioning quantum computing but provides no gate-based quantum finance method or methodological detail.
3c0efab51aec,exclude,925,0.9000,EX-NONFIN,The paper focuses on healthcare organizational frameworks rather than a financial application.
4199e72a2bd9,exclude,926,0.9000,EX-NONFIN,This paper is a broad AI/Python survey without a finance focus or gate-based quantum method contribution.
86876258d649,exclude,927,0.9000,EX-NONFIN,The paper focuses on speech recognition applications rather than any financial use case.
0c0025fa8fb8,exclude,928,0.9000,EX-NONFIN,"Paper discusses data interoperability and cross-platform communication, not gate-based quantum computing or financial applications."
593f3ec6b2cc,exclude,929,0.9000,EX-OTHER,The paper focuses on a post-quantum cryptographic blockchain protocol rather than gate-based quantum computing methods applied to finance.
651f11d727a7,exclude,930,0.9000,EX-NONFIN,General AI survey on data quality across industries without a gate-based quantum computing finance-specific application.
6e722ac4e566,exclude,931,0.9000,EX-NONFIN,This paper focuses on quantum cryptography for secure communication in the Dark-net and does not address a financial application.
cf38f3fdc231,exclude,932,0.9000,EX-PARADIGM,The paper is a survey on classical post-quantum cryptography rather than gate-based quantum computing methods in finance.
27e1a6f1a617,exclude,933,0.9000,EX-NONFIN,The paper is a market analysis of cloud AI services and lacks any gate-based quantum computing methodology or a focused financial application.
8af0b72fbbe5,exclude,934,0.9000,EX-OTHER,The paper does not propose or use any gate-based quantum computing approach relevant to financial applications.
f9f5bab30bd2,exclude,935,0.9000,EX-OTHER,Paper contains no gate-based quantum computing methodology.
bfb6c1a25bf0,exclude,936,0.9000,EX-NONFIN,Paper addresses cyberpsychology and identity theft rather than a gate-based quantum computing approach for a financial application.
59c6cac6736d,exclude,937,0.9000,EX-NONFIN,The paper focuses on AI system security rather than any quantum computing application in finance.
32be27773fc7,exclude,938,0.9000,EX-PARADIGM,The paper employs a quantum-inspired optimization algorithm rather than a gate-based quantum computing approach.
bd5a98f37c33,exclude,939,0.9000,EX-NOMETHOD,This paper is a systematic review without an original gate-based quantum computing method or detailed financial application contribution.
a446cd2190a6,exclude,940,0.9000,EX-OTHER,Paper does not involve any quantum computing methods.
aea5ffbd0359,exclude,941,0.9000,EX-PARADIGM,"The paper does not propose or use any gate-based quantum computing methods, focusing solely on classical lightweight ML design."
f7c4e688a81c,exclude,942,0.9000,EX-NONFIN,The paper focuses on AI sustainability and environmental impacts rather than gate-based quantum computing applications in finance.
a5362de45b60,exclude,943,0.9000,EX-NONFIN,The paper focuses on cryptographic techniques and network security rather than gate-based quantum computing applications in finance.
15ecb0ef5f59,exclude,944,0.9000,EX-NONFIN,Paper focuses on data encryption/decryption and does not address a financial application.
2cca88ec93e6,exclude,945,0.9000,EX-PARADIGM,The paper leverages quantum-inspired classical methods rather than any gate-based quantum computing approach.
2a44a148a3e7,exclude,946,0.9000,EX-NONFIN,"Paper focuses on general software engineering for research and industry, not on gate-based quantum computing applications in finance."
2d5f94dd1c2e,exclude,947,0.9000,EX-NONFIN,The paper focuses on AI in drug discovery with no finance application or gate-based quantum computing content.
46aaa97f9f65,exclude,948,0.9000,EX-TOOSHORT,No abstract or methodological details provided
cb7047eb4b01,exclude,949,0.9000,EX-NONFIN,Paper addresses AI disentanglement methods unrelated to finance or gate-based quantum computing applications.
8753098d5ea3,exclude,950,0.9000,EX-PARADIGM,"No gate-based quantum computing methods are proposed, focusing solely on classical federated learning."
0ae4b20c75d7,exclude,951,0.9000,EX-NONFIN,The paper focuses on lightweight post-quantum signature schemes for IoT security rather than gate-based quantum computing or finance applications.
