paper_id,ai_decision,ai_rank,ai_confidence,reason_code,reasoning
b76db96a4af5,include,1570,0.8500,INCLUDE,The paper uses gate-based Quantum Neural Networks for blockchain transaction clustering in a financial fraud detection context and provides sufficient methodological detail.
4dbaf2b286bf,include,1571,0.8500,INCLUDE,The paper proposes a gate-based variational quantum classifier applied to financial index modeling with sufficient methodological detail.
d0568e395fbf,exclude,1572,0.8500,EX-NONFIN,The paper is a broad review of quantum computing techniques without any specific financial application.
e3f0d48b8da0,exclude,1573,0.8500,EX-OTHER,The paper focuses on quantum cryptography and post-quantum security rather than applying gate-based quantum computing methods to solve financial problems.
66f43397ba83,include,1574,0.8500,INCLUDE,Proposes a gate-based quantum approach using qutrit arithmetic operations applied to financial derivative pricing with sufficient methodological detail.
9781ec456ae3,include,1575,0.8500,INCLUDE,The paper proposes a gate-based hybrid quantum-classical generative model applied to financial rare-event prediction with sufficient methodological detail.
305f12556257,exclude,1576,0.8500,EX-NONFIN,The paper focuses on quantum image classification for CIFAR-10 and does not address any financial application.
1dd5b0ff2bab,exclude,1577,0.8500,EX-NONFIN,"The paper is a survey on quantum readiness and post-quantum cryptography in cybersecurity, not a gate-based quantum finance application."
65ffb88bc38c,exclude,1578,0.8500,EX-PARADIGM,The paper uses quantum-inspired classical methods rather than a gate-based quantum computing approach.
9d21f2dbc900,exclude,1579,0.8500,EX-PARADIGM,The paper focuses solely on quantum annealing-based heuristics for QUBO without any gate-based quantum computing component.
741265670e7e,exclude,1580,0.8500,EX-TOOSHORT,No abstract or methodological details are provided to determine inclusion criteria compliance.
27af96a17b49,exclude,1581,0.8500,EX-NOMETHOD,This is a broad theoretical overview of quantum finance without specific gate-based methods or methodological details for finance applications.
a75c29a36d28,exclude,1582,0.8500,EX-NOMETHOD,The paper is a broad survey of quantum computing and AI integration without original gate-based financial methods or methodological detail.
04c5a2244874,exclude,1583,0.8500,EX-NONFIN,"The paper does not present a substantive financial application or detailed finance case study, only briefly mentioning finance among other fields without methodological detail for finance."
3c5c81d88487,exclude,1584,0.8500,EX-NONFIN,The paper focuses on jet tagging in high-energy physics rather than any financial application.
06db2582a06a,exclude,1585,0.8500,EX-NOMETHOD,This general introduction chapter is a survey without an original gate-based finance method or detailed methodological contribution.
d852a9493e14,exclude,1586,0.8500,EX-NOMETHOD,"This chapter appears to be a broad survey of quantum reinforcement learning applications, including finance, without sufficient original methodological detail for extraction."
251a3166cf94,include,1587,0.8500,INCLUDE,The paper proposes a gate-based QAOA method for carbon credit portfolio optimization (a financial use case) and provides sufficient methodological detail and experimental evaluation.
0525be4c60fb,exclude,1588,0.8500,EX-NONFIN,Focuses on healthcare billing rather than a financial application
cf15566d165b,include,1589,0.8500,INCLUDE,The paper proposes a gate-based quantum anomaly detection algorithm applicable to financial fraud detection and provides sufficient methodological detail.
f21d8f06ef9f,exclude,1590,0.8500,EX-NONFIN,Keynote is broad overview with no specific gate-based finance application or methodology.
7745d4a3425e,exclude,1591,0.8500,EX-NONFIN,Paper addresses quantum computing for computational fluid dynamics rather than a financial application.
980d054544f5,exclude,1592,0.8500,EX-PARADIGM,The paper exclusively uses quantum annealing on D-Wave instead of a gate-based quantum computing approach.
ebc4087b5ca1,exclude,1593,0.8500,EX-PARADIGM,Focuses on post-quantum cryptography and secure AI architectures rather than gate-based quantum computing methods for finance
c0545cc84ee9,exclude,1594,0.8500,EX-NONFIN,"The paper focuses on supply chain counterfeit detection via blockchain and quantum techniques, not a finance-related application."
cab849abe702,include,1595,0.8500,INCLUDE,"The paper proposes a gate-based hybrid quantum-classical QNLP method for financial text sentiment analysis with sufficient methodological detail to extract problem family, quantum method, and evaluation."
092f61fee6d5,exclude,1596,0.8500,EX-OTHER,"The paper does not propose or use any gate-based quantum computing methods, discussing only classical AI/ML techniques for fraud detection."
60f7527318ef,exclude,1597,0.8500,EX-NOMETHOD,This high-level survey lacks any specific gate-based quantum computing method or detailed financial application methodology.
09b4bc210a8c,exclude,1598,0.8500,EX-PARADIGM,This interview focuses on D-Wave’s quantum annealing applications without any gate-based quantum computing methods.
da1a51c22b3f,exclude,1599,0.8500,EX-PARADIGM,The paper focuses on quantum-resistant cryptography and AI methods rather than gate-based quantum computing approaches.
80b8ebe419a6,exclude,1600,0.8500,EX-NOMETHOD,This is a general AI-in-banking survey with no original gate-based quantum finance method contribution or detailed methodology.
2ee403459165,exclude,1601,0.8500,EX-NONFIN,Focuses on post-quantum cryptography rather than gate-based quantum computing applications in finance
e2db068618bd,exclude,1602,0.8500,EX-NOMETHOD,This is a broad survey of quantum AI in cloud environments without original finance-specific gate-based quantum methods or sufficient methodological detail.
846a375190ae,exclude,1603,0.8500,EX-NONFIN,This paper analyzes national financial policies for quantum computing commercialization rather than applying gate-based quantum algorithms to financial problems.
72d1e3ab82f4,exclude,1604,0.8500,EX-NONFIN,"The paper focuses on quantum-resistant cryptography and enterprise cybersecurity, not a financial application."
6070dad6f736,exclude,1605,0.8500,EX-NONFIN,The paper focuses on secure military communications and post-quantum cryptography in hybrid warfare rather than any financial application.
f3c6fc33baed,exclude,1606,0.8500,EX-PARADIGM,Paper focuses on post-quantum cryptography and classical AI methods rather than gate-based quantum computing applications.
659760ea0e88,exclude,1607,0.8500,EX-PARADIGM,The paper describes a classical Monte Carlo simulator with no actual gate-based quantum computing method implemented.
933cb882d120,exclude,1608,0.8500,EX-NONFIN,"The paper focuses on molecular property prediction in drug development, not on a financial application."
72a191fd2f47,include,1609,0.8500,INCLUDE,Proposes a gate-based quantum generative adversarial network for financial time series with sufficient methodological detail on circuit design and evaluation.
d0cb5c3f2a63,exclude,1610,0.8500,EX-PARADIGM,The paper proposes a classical fuzzy logic Fourier transform method without any gate-based quantum computing approach.
aa5b834c3a1d,exclude,1611,0.8500,EX-NONFIN,"The paper applies a quantum-semantic framework to knowledge systems and tail-risk in semantic spaces, not a financial use case."
4328ac0ca25b,exclude,1612,0.8500,EX-OTHER,Paper makes no gate-based quantum computing contribution and only mentions quantum computing as a future topic.
13440524a4c0,exclude,1613,0.8500,EX-NOMETHOD,The paper is a high-level survey of quantum computing's business impact with no original gate-based method details for finance.
cb87dd92737a,exclude,1614,0.8500,EX-PARADIGM,Paper uses quantum-inspired classical optimization rather than a gate-based quantum computing approach
2004cd587678,exclude,1615,0.8500,EX-PARADIGM,The paper contains only a passing mention of quantum computing without proposing or using any gate-based quantum method for finance applications.
313a1d740d27,include,1616,0.8500,INCLUDE,The paper proposes a gate-based hybrid quantum-classical kernel method applied to anomaly detection on financial transaction streams with sufficient methodological detail.
97554e190434,exclude,1617,0.8500,EX-PARADIGM,"The paper does not propose or use any gate-based quantum computing approach, discussing only general fintech trends without methodological quantum detail."
321bfc30b4fa,exclude,1618,0.8500,EX-TOOSHORT,"No abstract or content provided, insufficient detail to assess methodology or application."
25da778231cf,exclude,1619,0.8500,EX-NOMETHOD,This is a survey/review paper without original methodological contributions
e52f3f130a75,exclude,1620,0.8500,EX-NONFIN,Paper focuses on general workload partitioning in hybrid quantum-classical systems without addressing a specific financial application.
b4785e9fa811,exclude,1621,0.8500,EX-NONFIN,"The paper focuses on digital signature authentication, which is unrelated to financial applications."
f3c77d3e6ee0,include,1622,0.8500,INCLUDE,The paper proposes a hybrid gate-based quantum-classical algorithm applied to robust optimization with explicit finance applications and sufficient methodological detail.
667ca5a60b35,exclude,1623,0.8500,EX-NOMETHOD,The work is a management philosophy book with no original gate-based quantum finance methods or sufficient methodological detail.
4f428be7e7d7,exclude,1624,0.8500,EX-PARADIGM,The paper focuses exclusively on quantum annealing without employing any gate-based quantum computing approach.
51c9861f1ba4,exclude,1625,0.8500,EX-NONFIN,Focuses on quantum-secured blockchain security rather than gate-based quantum computing applications in finance.
20f572f379be,exclude,1626,0.8500,EX-NONFIN,The paper focuses on post-quantum cryptography for document management rather than a financial application.
38c9c05fedf3,exclude,1627,0.8500,EX-NONFIN,"The paper is not about a financial application or gate-based quantum computing method but focuses on ERP integration with IoT, AI, and blockchain in general business contexts."
c1099bb22b6f,exclude,1628,0.8500,EX-NOMETHOD,The paper is a broad survey of disruptive technologies with no original gate-based quantum computing method detailed.
e8333614ccce,include,1629,0.8500,INCLUDE,Proposes a gate-based amplitude amplification algorithm for financial fraud ring identification with sufficient methodological detail.
652a566f8a78,exclude,1630,0.8500,EX-TOOSHORT,Abstract provides only buzzwords without any methodological detail or concrete quantum approach.
a682a2680c67,exclude,1631,0.8500,EX-TOOSHORT,Abstract provides only buzzwords without methodological detail or original gate-based quantum finance contribution
2fd5765499d8,exclude,1632,0.8500,EX-TOOSHORT,Abstract contains only keywords without any methodological detail or gate-based quantum computing approach.
3c4e531be7f6,exclude,1633,0.8500,EX-NOMETHOD,The paper is a high-level conceptual volume without any original gate-based quantum computing method or detailed financial application.
a68afe1bb086,exclude,1634,0.8500,EX-NOMETHOD,Broad industry discussion without any specific quantum finance method or methodological detail.
6e3988f90341,exclude,1635,0.8500,EX-NONFIN,The paper discusses quantum mechanical foundations without addressing any financial application or gate-based method in finance.
e08aa0769f7a,exclude,1636,0.8500,EX-NOMETHOD,This is a survey/review without an original gate-based quantum finance method contribution.
75c40280653d,exclude,1637,0.8500,EX-NOMETHOD,The abstract provides high-level motivations for using QML in banking but lacks any methodological detail on the quantum approach or evaluation protocol.
ed0cf943abee,exclude,1638,0.8500,EX-NONFIN,"The paper centers on cybersecurity applications of quantum computing and AI, not a specific financial use case."
213893cc9b1e,exclude,1639,0.8500,EX-OTHER,Does not propose or use any gate-based quantum computing method for finance but is a theoretical monograph on evolutionary systems and statistical mechanics.
6a9b7a53cfc6,exclude,1640,0.8500,EX-NONFIN,Paper addresses misinformation detection rather than any financial application.
6ebc403a8269,exclude,1641,0.8500,EX-PARADIGM,"The paper presents a classical, quantum-inspired simulated bifurcation approach on FPGA rather than a gate-based quantum computing method."
3884fb4b9ae7,exclude,1642,0.8500,EX-NONFIN,"Paper focuses on quantum-resistant encryption for critical infrastructure, not a finance application."
5255644c5393,exclude,1643,0.8500,EX-NONFIN,The paper focuses on network security and quantum cryptography without addressing any financial applications.
5e828a070fa3,exclude,1644,0.8500,EX-PARADIGM,Paper focuses on hybrid post-quantum cryptography rather than gate-based quantum computing methods for finance.
cd9b7c83ff08,exclude,1645,0.8500,EX-OTHER,"The paper does not involve any gate-based quantum computing methods, only microservices and AI in financial systems modernization."
1d7c5e5804a2,exclude,1646,0.8500,EX-TOOSHORT,No abstract or content available to assess methodology or application details.
087f9ed32b64,exclude,1647,0.8500,EX-NONFIN,Title and lack of abstract show no financial or quantum computing content.
968d2f036cce,exclude,1648,0.8500,EX-NONFIN,Focuses on ethical and regulatory aspects of quantum AI in cybersecurity rather than a gate-based quantum computing finance application.
c986dab65773,exclude,1649,0.8500,EX-NONFIN,Paper is a survey on quantum secret sharing in blockchain systems with no financial application
504273d5c3ff,exclude,1650,0.8500,EX-NONFIN,Title indicates general machine learning applications without any indication of gate-based quantum methods or financial application.
9c24fb97051a,exclude,1651,0.8500,EX-TOOSHORT,No abstract or methodological detail available to assess financial or gate-based quantum content.
dfd464e83103,exclude,1652,0.8500,EX-TOOSHORT,This corrigendum provides no substantive content or methodological detail relevant to gate-based quantum computing in finance.
cc92ea951274,exclude,1653,0.8500,EX-OTHER,Focuses on quantum cryptography and blockchain security rather than gate-based quantum computing methods for financial computation
695030966ec1,exclude,1654,0.8500,EX-PARADIGM,Paper addresses longevity risk and capital markets without any quantum computing methodology.
f55fea197b67,include,1655,0.8500,INCLUDE,The paper uses a gate-based quantum algorithm (QSVM) for a finance use case (loan risk forecasting) with sufficient methodological detail.
97f724169c71,exclude,1656,0.8500,EX-NONFIN,The paper does not address gate-based quantum computing nor focus on a finance-specific quantum application.
69e39e47af08,exclude,1657,0.8500,EX-NOMETHOD,This is a broad survey chapter without original finance-specific gate-based quantum computing methods nor enough methodological detail for extraction.
295d7bd45e0a,exclude,1658,0.8500,EX-NONFIN,"Focuses on quantum channel encoding and communication theory, with no financial application"
e60a58d4d883,exclude,1659,0.8500,EX-PARADIGM,"The paper does not use or propose any gate-based quantum computing approach, focusing solely on big data and AI methods."
3e62983e8662,exclude,1660,0.8500,EX-NONFIN,"The paper focuses on DDoS attack detection and cybersecurity, not a financial use case."
7fbe1fc99111,exclude,1661,0.8500,EX-OTHER,The paper discusses accounting ethics in digitalization without proposing or applying any gate-based quantum computing methods in a financial context.
e0666183e1e5,exclude,1662,0.8500,EX-NONFIN,Paper focuses on post-quantum image encryption rather than a financial application.
3a3afd9ba990,exclude,1663,0.8500,EX-NONFIN,The paper addresses cybersecurity DDoS detection rather than a financial application.
ce060a15d325,exclude,1664,0.8500,EX-NOMETHOD,The paper does not propose or use any gate-based quantum computing method for a financial application.
732f54a585cf,exclude,1665,0.8500,EX-NONFIN,"The paper applies hybrid quantum-classical methods to ransomware detection, which is a cybersecurity application, not a financial use case."
c151d7063055,exclude,1666,0.8500,EX-PARADIGM,This paper focuses on quantum communication technologies rather than gate-based quantum computing for finance applications.
4bf145be7a93,exclude,1667,0.8500,EX-PARADIGM,"No gate-based quantum computing methods are proposed or used, focusing solely on big data information systems."
00a87d2f3a7a,exclude,1668,0.8500,EX-NONFIN,General real-time data engineering survey with no gate-based quantum computing method for financial applications.
ae487b0b0dbb,exclude,1669,0.8500,EX-PARADIGM,The paper focuses on post-quantum lattice-based cryptography for blockchain security rather than any gate-based quantum computing method.
a1de67fd60d2,exclude,1670,0.8500,EX-OTHER,"The paper does not involve any gate-based quantum computing approach, focusing solely on classical AI methods in finance."
3035eb487248,exclude,1671,0.8500,EX-NONFIN,General AI trends survey with no specific gate-based quantum finance application or methodological detail.
b6bdf9133adb,exclude,1672,0.8500,EX-NONFIN,The paper focuses on data center energy efficiency and supply chain management without any gate-based quantum computing application in finance.
9814aa5b1e99,exclude,1673,0.8500,EX-NONFIN,The paper is a general overview of photonics without any focus on financial applications or gate-based quantum computing.
778a06edc7f8,exclude,1674,0.8500,EX-NONFIN,Focuses on quantum decision theory in social decision-making rather than gate-based quantum computing for financial applications.
29c50ea45ebe,exclude,1675,0.8500,EX-NONFIN,The paper is a systematic review of quantum-resistant cryptography rather than a gate-based quantum computing application in finance.
a1d7c6d474bf,exclude,1676,0.8500,EX-NONFIN,This paper is a domain-agnostic terminological method application volume with no gate-based quantum finance use case
ead7c0430727,exclude,1677,0.8500,EX-NONFIN,The paper studies adoption of quantum software in general software development without any financial application
44a9c1e19ac3,exclude,1678,0.8500,EX-NONFIN,Paper addresses QKD network simulation in quantum communication without any financial application.
8e9b91bf70a1,exclude,1679,0.8500,EX-NOMETHOD,This broad survey provides no original gate-based quantum computing method for finance applications.
78f6379ed79b,exclude,1680,0.8500,EX-PARADIGM,The paper focuses on post-quantum cryptographic protocols for blockchain security rather than gate-based quantum computing methods.
f4128265a325,exclude,1681,0.8500,EX-PARADIGM,Paper focuses on quantum key distribution cryptography rather than gate-based quantum computing methods.
ff3983d897f5,exclude,1682,0.8500,EX-NONFIN,The paper is a general technology overview with no specific financial application or gate-based quantum computing method.
0c096ea91205,exclude,1683,0.8500,EX-NONFIN,The paper focuses on advanced manufacturing practices rather than finance and lacks a financial application.
38302fd5ca29,exclude,1684,0.8500,EX-PARADIGM,The paper describes a coherent optical annealing approach (Coherent Ising Machine) with no gate-based quantum computing component.
f711153148a1,exclude,1685,0.8500,EX-TOOSHORT,No abstract or methodological detail is available to assess finance application or quantum gate-based methods.
7757b0d161e8,exclude,1686,0.8500,EX-NONFIN,Paper focuses on cybersecurity and post-quantum cryptography rather than gate-based quantum computing methods applied to finance.
1a05f3c9e973,exclude,1687,0.8500,EX-NOMETHOD,This is a high-level systematic literature review without original gate-based quantum method contributions or sufficient methodological detail for extraction.
8a67cf656c63,exclude,1688,0.8500,EX-NONFIN,The paper is a speculative quantum consciousness framework with no financial application or gate-based quantum computing methodology.
fd32bd36033f,exclude,1689,0.8500,EX-NONFIN,The paper is a cryptography survey unrelated to financial applications.
d717d7f7f779,exclude,1690,0.8500,EX-PARADIGM,The paper focuses on post-quantum cryptographic schemes for blockchain rather than gate-based quantum computing methods.
08e9846d3e50,exclude,1691,0.8500,EX-NONFIN,"The paper focuses on pathology job market and AI in medicine, without addressing finance or gate-based quantum computing methods."
5b3485ced673,exclude,1692,0.8500,EX-NONFIN,The paper focuses on investment risk analysis of quantum technologies rather than applying gate-based quantum methods to financial problems.
b2cc85a6587a,exclude,1693,0.8500,EX-NONFIN,This paper describes hardware coherence and verification methods without any financial application.
918819c5797b,exclude,1694,0.8500,EX-NONFIN,The paper focuses on AI-driven data governance compliance and not on financial applications or gate-based quantum computing methods.
17ef268d6ad8,exclude,1695,0.8500,EX-PARADIGM,The paper does not propose or use a gate-based quantum computing algorithm but focuses on a formal dialectical logic system.
69eb4bd3076c,exclude,1696,0.8500,EX-NONFIN,The paper is an editorial on quantum cryptography and communication without any finance application or gate-based quantum computing methodology.
2d5897eed295,exclude,1697,0.8500,EX-NONFIN,The paper addresses marketing leadership and AI organizational frameworks rather than financial applications with gate-based quantum methods.
ce98c1df7f94,exclude,1698,0.8500,EX-NONFIN,This paper addresses AI/ML-based cybersecurity in healthcare and does not involve gate-based quantum computing or a financial application.
37ec4cec7601,exclude,1699,0.8500,EX-NONFIN,This is an index for a management/CSR book with no gate-based quantum computing or financial application content.
da90378ba595,exclude,1700,0.8500,EX-NONFIN,"The paper describes a nanofabrication facility and its applications in various fields, with no gate-based quantum computing methods applied to finance."
4093c2c4b72a,exclude,1701,0.8500,EX-NONFIN,The paper does not propose any gate-based quantum computing methods nor detail a financial application use case.
5e9b7cd8212d,exclude,1702,0.8500,EX-NONFIN,The paper focuses on hybrid cloud architecture without any financial application or quantum computing methods.
06494e31ea00,exclude,1703,0.8500,EX-TOOSHORT,No abstract or methodological details available to assess inclusion criteria.
0e07f27e1d0c,exclude,1704,0.8500,EX-NONFIN,The paper focuses on cybersecurity rather than any financial application.
b74070125eb9,exclude,1705,0.8500,EX-PARADIGM,The paper focuses solely on quantum annealing without a gate-based quantum computing component.
39c957313bd1,exclude,1706,0.8500,EX-NONFIN,Paper does not address quantum computing or a financial application.
c07bf2c04ef9,exclude,1707,0.8500,EX-TOOSHORT,This is a correction notice with no abstract or sufficient methodological detail available.
351b5122b08d,exclude,1708,0.8500,EX-PARADIGM,The paper addresses post-quantum cryptography rather than a gate-based quantum computing approach.
01a1ecaddb94,exclude,1709,0.8500,EX-TOOSHORT,No abstract or methodological detail available to assess gate-based quantum approach
914ea9b006b5,include,1710,0.8500,INCLUDE,The title indicates a gate-based quantum reinforcement learning approach using Cirq for a concrete financial use case (high-frequency trading optimization).
9c4681ed0b36,exclude,1711,0.8500,EX-OTHER,No gate-based quantum computing approach is mentioned.
8767284d28a2,exclude,1712,0.8500,EX-OTHER,No evidence of a gate-based quantum computing approach or related methodological details.
f95baa9af311,exclude,1713,0.8500,EX-TOOSHORT,No abstract or methodological details available to assess inclusion criteria
6952e33d189b,exclude,1714,0.8500,EX-PARADIGM,The paper focuses on post-quantum cryptography for cybersecurity rather than gate-based quantum computing applications in finance.
0cd957e223ad,exclude,1715,0.8500,EX-NONFIN,Title indicates cybersecurity focus with no finance application.
34c848366458,exclude,1716,0.8500,EX-TOOSHORT,"No abstract or methodological details are provided, preventing assessment of quantum gate-based methods or finance use case specifics."
bfd13c680dfb,exclude,1717,0.8500,EX-NONFIN,No indication of a financial application in a photonics overview paper.
c0da85ef2954,include,1718,0.8500,INCLUDE,Proposes a gate-based quantum Alternating Operator Ansatz for a financial portfolio diversification problem
1502fad8d8ac,exclude,1719,0.8500,EX-TOOSHORT,No abstract available and insufficient methodological detail provided.
9474227ca608,exclude,1720,0.8500,EX-NONFIN,Paper is a general AI survey with no focus on finance or gate-based quantum computing applications.
48b7d8d88f11,exclude,1721,0.8500,EX-NONFIN,"The paper applies quantum concepts to human communication, not a financial application."
2e46827349ad,exclude,1722,0.8500,EX-NONFIN,No quantum computing content or financial application is presented in this workshop description.
a69c6a4304c8,exclude,1723,0.8500,EX-NONFIN,Title and lack of abstract show no gate-based quantum computing or clear finance application.
c60f7a25291e,exclude,1724,0.8500,EX-NONFIN,The paper focuses on general AI system trustworthiness and does not address a gate-based quantum computing application in finance.
ce0ffad1a7a5,exclude,1725,0.8500,EX-NONFIN,The paper focuses on explainable AI with Boolean formulas and lacks any quantum computing or financial application.
6e39c2d1ab16,exclude,1726,0.8500,EX-NONFIN,This paper presents a general quantum benchmarking framework without any financial application
4f07d45db4c6,exclude,1727,0.8500,EX-NONFIN,"The paper focuses on hyperspectral imagery for semi-supervised learning, which is unrelated to financial applications."
