paper_id,title,year,venue,doi,doi_url,has_doi
00e181896bba,Pioneering Quantum Computing in Financial Services,2025,,10.4018/979-8-3373-2893-5.ch013,https://doi.org/10.4018/979-8-3373-2893-5.ch013,yes
01a1ecaddb94,Optimized Stock Price Forecasting: A Deep Learning Approach Using QCTO Based GRU Network,2025,International Conference on Computing Intelligence and Application Ciacon 2025,10.1109/CIACON65473.2025.11189776,https://doi.org/10.1109/CIACON65473.2025.11189776,yes
01e7ba36bcfc,Analysis of a hybrid quantum network for classification tasks,2021,IET Quantum Communication,10.1049/qtc2.12017,https://doi.org/10.1049/qtc2.12017,yes
02db829631f9,Quantum Optimization for Portfolio Management in Financial Services Using the Variational Quantum Eigensolver (VQE) Algorithm,2025,2025 Second International Conference on Networks and Soft Computing (ICNSoC),10.1109/ICNSoC66817.2025.00113,https://doi.org/10.1109/ICNSoC66817.2025.00113,yes
04326473e1bb,Quantum Algorithms for Solving Large-Scale Optimization Problems: Challenges and Breakthroughs,2025,2025 3rd International Conference on Intelligent Cyber Physical Systems and Internet of Things (ICoICI),10.1109/ICoICI65217.2025.11254519,https://doi.org/10.1109/ICoICI65217.2025.11254519,yes
045306ad1a16,CVaR-Based Variational Quantum Optimization for User Association in Handoff-Aware Vehicular Networks,2025,ICC 2025 - IEEE International Conference on Communications,10.1109/ICC52391.2025.11161596,https://doi.org/10.1109/ICC52391.2025.11161596,yes
0525be4c60fb,Application of quantum computing in healthcare billing - USA,2025,International Journal of Science and Research Archive,10.30574/ijsra.2025.14.1.0102,https://doi.org/10.30574/ijsra.2025.14.1.0102,yes
060ebc7a91c0,Empirical Analysis of Quantum Compution using Qiskit Framework,2023,2023 9th International Conference on Advanced Computing and Communication Systems (ICACCS),10.1109/ICACCS57279.2023.10112866,https://doi.org/10.1109/ICACCS57279.2023.10112866,yes
06c5f405d529,Quantum Computing For Health And Financial Decision-Making: Empowering Employees To Improve Life And Finance,2025,SSRN Electronic Journal,10.2139/ssrn.5071354,https://doi.org/10.2139/ssrn.5071354,yes
06db2582a06a,Introduction to Quantum Computing,2026,Auerbach Publications eBooks,10.1201/9781003674566-1,https://doi.org/10.1201/9781003674566-1,yes
06fdf18c23c4,A Hybrid Quantum-Classical Model for Stock Price Prediction Using Quantum-Enhanced Long Short-Term Memory,2024,Entropy,10.3390/e26110954,https://doi.org/10.3390/e26110954,yes
0801deffcfa4,Harnessing Quantum Computing for Predictive Analysis,2026,Auerbach Publications eBooks,10.1201/9781003587835-4,https://doi.org/10.1201/9781003587835-4,yes
082f292f8c48,Hybrid Encoding-based Quantum Self Attention for Financial Time Series Analysis,2025,,10.1109/icasspw65056.2025.11011079,https://doi.org/10.1109/icasspw65056.2025.11011079,yes
0ab110ae249c,Coherence-Gated Dimensional Access: Derivation and Physical Validation of D_eff = D_max × Φ(C),2026,Zenodo (CERN European Organization for Nuclear Research),10.5281/zenodo.18839366,https://doi.org/10.5281/zenodo.18839366,yes
0ab4724fd60f,Risk management strategies: Navigating volatility in complex financial market environments,2025,World Journal of Advanced Research and Reviews,10.30574/wjarr.2025.25.1.0057,https://doi.org/10.30574/wjarr.2025.25.1.0057,yes
0b40a3e55edc,QAMOO: Quantum Approximate Multi-Objective Optimization for Portfolio Management,2026,Zenodo (CERN European Organization for Nuclear Research),10.5281/zenodo.18353289,https://doi.org/10.5281/zenodo.18353289,yes
0b549647c8e5,Scaling Analysis of Quantum Amplitude Estimation for Tokenized Asset Option Pricing: Validation and Barriers to Practical Advantage,2026,,10.13140/rg.2.2.18561.31849,https://doi.org/10.13140/rg.2.2.18561.31849,yes
0d70169cb87f,A Comparative Study of Classical and Quantum Machine Learning for Large-Scale Financial Forecasting,2024,"Robotics, Autonomous, Machine Learning, and Artificial intelligence Journal",10.64206/h26qc363,https://doi.org/10.64206/h26qc363,yes
0e18f027f93b,Quantum-Assisted Optimal Rebalancing with Uncorrelated Asset Selection for Algorithmic Trading Walk-Forward QUBO Scheduling via QAOA,2026,,10.13140/rg.2.2.25392.62728,https://doi.org/10.13140/rg.2.2.25392.62728,yes
0e2942155b17,Classical optimization with imaginary time block encoding on quantum computers: The MaxCut problem,2024,Physical Review A,10.1103/gtq3-j37b,https://doi.org/10.1103/gtq3-j37b,yes
0f3a64e9e3ed,Quantitative Analysis and Forecasting Techniques in Financial Markets: A 2022 Review,2022,Financial Economics Insights,10.70088/wfwcn555,https://doi.org/10.70088/wfwcn555,yes
0fb8e2505865,Designing an AIOps (Artificial Intelligent Operations) Framework for Energy-Efficient IT Operations: A Case Study on Cloud Computing Environment,2025,2025 IEEE International Symposium on Future Telecommunication Technologies (SOFTT),10.1109/SOFTT67007.2025.11213027,https://doi.org/10.1109/SOFTT67007.2025.11213027,yes
10832c99e683,Cost Savings Through Quantum AI-Driven Optimizations,2026,Advances in computational intelligence and robotics book series,10.4018/979-8-3373-4347-1.ch004,https://doi.org/10.4018/979-8-3373-4347-1.ch004,yes
109c9406f3df,"Quantum Graph Neural Networks for Portfolio Optimization in Complex Financial Markets, A Novel Approach",2024,2024 International Conference on Trends in Quantum Computing and Emerging Business Technologies,10.1109/TQCEBT59414.2024.10545170,https://doi.org/10.1109/TQCEBT59414.2024.10545170,yes
10a2f644907f,Quantum-inspired evolutionary algorithms,2025,,10.1201/9781003612858-2,https://doi.org/10.1201/9781003612858-2,yes
10be86fe1795,A Comparative Analysis of Hybrid Quantum Neural Networks in Binary Credit Defaulting Tasks,2023,,10.1109/urtc60662.2023.10535032,https://doi.org/10.1109/urtc60662.2023.10535032,yes
115e509ec529,Hybrid Quantum Market State Inference for Ultra-Short-Horizon Financial Prediction,2025,Zenodo (CERN European Organization for Nuclear Research),10.5281/zenodo.17924888,https://doi.org/10.5281/zenodo.17924888,yes
119578338c9e,Quantum Finance: Revolutionizing Financial Markets with Quantum Computing,2025,Auerbach Publications eBooks,10.1201/9781003482154-6,https://doi.org/10.1201/9781003482154-6,yes
1292782ed153,CryptoQNet: Leveraging Quantum Computing for Enhanced Cryptocurrency Market Analysis,2025,2025 International Conference on Emerging Smart Computing and Informatics (ESCI),10.1109/ESCI63694.2025.10988262,https://doi.org/10.1109/ESCI63694.2025.10988262,yes
13544c1e7414,Quantum Machine Learning for Stock Price Movement Prediction,2025,Uncertainty and operations research,10.1007/978-981-95-2429-7_7,https://doi.org/10.1007/978-981-95-2429-7_7,yes
135bf0e19b10,Performance evaluation of post quantum digital signature algorithms over WDM optical communication system,2025,Journal of Optical Communications,10.1515/joc-2025-0104,https://doi.org/10.1515/joc-2025-0104,yes
14777484b99d,Quantum Algorithm for Unsupervised Anomaly Detection,2023,SSRN Electronic Journal,10.2139/ssrn.4435630,https://doi.org/10.2139/ssrn.4435630,yes
1502fad8d8ac,Applying Quantum Computing to the Renewable Energy Stock Exchange to Reduce the Risk of Investment,2024,Lecture Notes in Networks and Systems,10.1007/978-981-99-8346-9_38,https://doi.org/10.1007/978-981-99-8346-9_38,yes
157054b518f8,Quantum computing research: An in-depth exploration,2025,Advances in computers,10.1016/bs.adcom.2025.02.005,https://doi.org/10.1016/bs.adcom.2025.02.005,yes
163d8d584a33,Hybrid QLSTM Framework for Time Series Forecasting in Dynamic Financial Markets,2025,International Conference on Innovative Mechanisms for Industry Applications,10.1109/ICIMIA67127.2025.11200988,https://doi.org/10.1109/ICIMIA67127.2025.11200988,yes
16d418f1da92,A More General Quantum Credit Risk Analysis Framework,2023,Entropy,10.3390/e25040593,https://doi.org/10.3390/e25040593,yes
173cd12aee6b,A Quantum Algorithm for Pricing Asian Options on Valuation Trees,2022,Risks,10.3390/risks10120221,https://doi.org/10.3390/risks10120221,yes
1760158c7e1b,Option Pricing using Quantum Computers,2019,Repository for Publications and Research Data (ETH Zurich),10.3929/ethz-b-000428448,https://doi.org/10.3929/ethz-b-000428448,yes
176f4217cb91,Explainable hybrid quantum neural networks for analyzing the influence of tweets on stock price prediction,2024,Computers & electrical engineering,10.1016/j.compeleceng.2024.109302,https://doi.org/10.1016/j.compeleceng.2024.109302,yes
1858371f4c44,Autonomous Quantum Agents for Portfolio Optimization: Orchestrating QAOA Workflows on Cloud Quantum Simulators,2026,,10.13140/rg.2.2.10881.31842,https://doi.org/10.13140/rg.2.2.10881.31842,yes
1961129130d1,Exploring the Versatility of QAOA: A Comprehensive Review,2024,International Conference on Computing Communication and Networking Technologies,10.1109/ICCCNT61001.2024.10725610,https://doi.org/10.1109/ICCCNT61001.2024.10725610,yes
1a05f3c9e973,Leveraging quantum computing business applications: a B-SLR approach and future research directions,2026,EPJ Quantum Technology,10.1140/epjqt/s40507-026-00475-1,https://doi.org/10.1140/epjqt/s40507-026-00475-1,yes
1b554a506320,"A Study on Quantum and Classical Simulations for Molecular Systems, Materials Science and Financial Modeling",2025,2025 IEEE Pune Section International Conference (PuneCon),10.1109/PuneCon67554.2025.11379349,https://doi.org/10.1109/PuneCon67554.2025.11379349,yes
1bf5fc02b95b,QEA-FAD: Quantum Enhanced Autoencoders for Anomaly Detection in Finance and Healthcare,2025,2025 International Conference on Networks and Cryptology (NETCRYPT),10.1109/NETCRYPT65877.2025.11102801,https://doi.org/10.1109/NETCRYPT65877.2025.11102801,yes
1c4934de7d9a,The Application of Quantum Approximation Optimization Algorithm in Portfolio Optimization,2023,Dianzi Keji Daxue Xuebao Journal of the University of Electronic Science and Technology of China,10.12178/1001-0548.2022019,https://doi.org/10.12178/1001-0548.2022019,yes
1d49f2843829,Quantum Computing Applications in Financial Modeling and Portfolio Optimization,2025,International Journal For Multidisciplinary Research,10.36948/ijfmr.2025.v07i06.62036,https://doi.org/10.36948/ijfmr.2025.v07i06.62036,yes
1dc251ce8c53,Extrapolation method to optimize linear-ramp quantum approximate optimization algorithm parameters: dataset,2026,Zenodo (CERN European Organization for Nuclear Research),10.5281/zenodo.18302992,https://doi.org/10.5281/zenodo.18302992,yes
1de0ca5e8cf2,Quantum Machine Learning Based on K-Means to Optimize Cross-Border Intelligent Payment Supervision,2024,ICBAR,10.1145/3718751.3718859,https://doi.org/10.1145/3718751.3718859,yes
20063e119947,Quantum Walk–Inspired Fourier Operators for Markovian Dynamics and Modular Structure Detection,2025,2025 6th International Conference on Machine Learning and Computer Application (ICMLCA),10.1109/ICMLCA66850.2025.11336551,https://doi.org/10.1109/ICMLCA66850.2025.11336551,yes
205f3d35d4be,Analyzing the Financial Impact of Corporate Social Responsibility Using Quantum Neural Transformer Models,2025,,10.1109/icctdc64446.2025.11158042,https://doi.org/10.1109/icctdc64446.2025.11158042,yes
20c7e1972b0b,Optimizing Mutual Fund Portfolio Management through the Application of Advanced Soft Computing Techniques,2024,,10.1109/iceeict61591.2024.10718611,https://doi.org/10.1109/iceeict61591.2024.10718611,yes
2291b049d70f,Application of Quantum Computing in Discrete Portfolio Optimization,2022,SSRN Electronic Journal,10.2139/ssrn.4130879,https://doi.org/10.2139/ssrn.4130879,yes
23311f65fe2a,Solving Feature Selection Problem by Quantum Optimization Algorithm,2023,Lecture notes on data engineering and communications technologies,10.1007/978-3-031-46573-4_18,https://doi.org/10.1007/978-3-031-46573-4_18,yes
235183650ee0,Quantum Neural Network for Time Series Forecasting: Harnessing Quantum Computing's Potential in Predictive Modeling,2023,2023 2nd International Conference on Futuristic Technologies (INCOFT),10.1109/INCOFT60753.2023.10425465,https://doi.org/10.1109/INCOFT60753.2023.10425465,yes
23e03dc57b20,Computational Results for a Quantum Computing Application in Real-Life Finance,2023,,10.1109/qce57702.2023.00054,https://doi.org/10.1109/qce57702.2023.00054,yes
246963801530,A Systematic Literature Review of Classical and Quantum Machine Learning Approaches for Mutual Fund Portfolio Optimization,2023,,10.1109/punecon58714.2023.10450063,https://doi.org/10.1109/punecon58714.2023.10450063,yes
24ca4814e7f2,Quantum Algorithms for Optimization Problems,2026,Lecture Notes in Computer Science,10.1007/978-3-031-95296-8_17,https://doi.org/10.1007/978-3-031-95296-8_17,yes
250a9d44ef66,Quantum Computing: Algorithms and Applications in Optimization Problems,2024,Journal of Quantum Science and Technology.,10.36676/jqst.v1.i2.11,https://doi.org/10.36676/jqst.v1.i2.11,yes
251a3166cf94,hgribeirogeo/qaoa-carbon-cerrado: v1.0 - Initial Release for Quantum Journal Submission,2026,Zenodo (CERN European Organization for Nuclear Research),10.5281/zenodo.18418054,https://doi.org/10.5281/zenodo.18418054,yes
258cef4e076f,Navigating optimization and security challenges in the AI-driven digital economy: from classical limits to quantum solutions,2025,IET conference proceedings.,10.1049/icp.2025.2981,https://doi.org/10.1049/icp.2025.2981,yes
26668f5bb362,Quantum-Enhanced AI and Machine Learning: Transforming Predictive Analytics,2025,Recent Advances in Electrical &amp; Electronic Engineering (Formerly Recent Patents on Electrical &amp; Electronic Engineering),10.2174/0123520965377470250225062938,https://doi.org/10.2174/0123520965377470250225062938,yes
26d9ab80fc82,Research on Financial Stock Market Prediction Based on the Hidden Quantum Markov Model,2025,Mathematics,10.3390/math13152505,https://doi.org/10.3390/math13152505,yes
270d264b98f3,Quantum Option Profit and Loss Encoding for Risk Assessment,2025,IEEE Transactions on Emerging Topics in Computational Intelligence,10.1109/tetci.2025.3593781,https://doi.org/10.1109/tetci.2025.3593781,yes
2896abff2596,Hybrid Quantum-Classical Transfer Learning Model for Credit Risk Assessment with Reduced Quantum Overhead and Enhanced Minority Class Prediction,2025,International Conference on Quantum Computing and Engineering,10.1109/QCE65121.2025.10374,https://doi.org/10.1109/QCE65121.2025.10374,yes
28ab67c2d22a,Experimental Demonstration of Fermionic QAOA with One-Dimensional Cyclic Driver Hamiltonian,2023,,10.1109/qce57702.2023.00041,https://doi.org/10.1109/qce57702.2023.00041,yes
291abba8a19e,QuanFraud: Quantum State Verification Scheme for Fraud Detection in IoT-Assisted Quantum-Blockchain Networks,2025,IEEE Transactions on Services Computing,10.1109/tsc.2025.3635525,https://doi.org/10.1109/tsc.2025.3635525,yes
29f1f2555efe,A Technical Review of Quantum Computing Use-Cases for Finance and Economics,2025,Preprints.org,10.20944/preprints202511.1802.v1,https://doi.org/10.20944/preprints202511.1802.v1,yes
2a5efc7b8178,Design of a Blockchain-Driven Quantum Identity Model Using QHA-AC FQET and RL-QIDA Methods in Cloud Microservices,2025,2025 First International Conference on Intelligent Computing and Systems at the Edge (ICEdge),10.1109/ICEdge67252.2025.11412890,https://doi.org/10.1109/ICEdge67252.2025.11412890,yes
2a646809136c,Hybrid Quantum-Classical Method for Bank Account Fraud Detection using Quantum Encoding and Quantum Machine Learning,2024,2024 IEEE MIT Undergraduate Research Technology Conference (URTC),10.1109/URTC65039.2024.10937533,https://doi.org/10.1109/URTC65039.2024.10937533,yes
2a9cd8a96604,Quantum support vector data description for anomaly detection,2024,Machine Learning Science and Technology,10.1088/2632-2153/ad6be8,https://doi.org/10.1088/2632-2153/ad6be8,yes
2abf80ef91e3,Optimizing Hybrid Quantum-Classical Models Using Parameterized Quantum Circuits for Time-Series Forecasting,2025,,10.36227/techrxiv.175295886.67877890/v1,https://doi.org/10.36227/techrxiv.175295886.67877890/v1,yes
2ae3455aa47b,Variational Quantum Algorithms: From Theory to NISQ-Era Applications Challenges and Opportunities,2025,Preprints.org,10.20944/preprints202508.1482.v1,https://doi.org/10.20944/preprints202508.1482.v1,yes
2b34eb642f89,Quantum Bridge Analytics II: Network Optimization and Combinatorial Chaining for Asset Exchange,2019,arXiv (Cornell University),10.13140/rg.2.2.33981.00480,https://doi.org/10.13140/rg.2.2.33981.00480,yes
2b4dc3c2ba75,Quantum Algorithms for Stochastic Differential Equations: Achieving Polynomial and Super-Polynomial Speedups for High-Dimensional Systems,2026,,10.22541/au.176764501.12582212/v1,https://doi.org/10.22541/au.176764501.12582212/v1,yes
2c1bf46ead5a,"Quantum-Enhanced Anomaly Detection in Subsea Well Sensors: A Comparative Study of Variational Quantum, Hybrid, and Classical Approaches.",2026,Zenodo (CERN European Organization for Nuclear Research),10.5281/zenodo.18644525,https://doi.org/10.5281/zenodo.18644525,yes
2dd59afb46ba,Qutrit-Based Quantum-Inspired Optimization Model on Real-World Portfolio Optimization,2024,,10.1109/qce60285.2024.10403,https://doi.org/10.1109/qce60285.2024.10403,yes
2e35d78fa802,Solving Subset Sum Problems using Binary Optimization with Applications in Auditing and Financial Data Analysis,2022,,10.36227/techrxiv.18994160,https://doi.org/10.36227/techrxiv.18994160,yes
2f0fa544425a,Quantum Blockchain: A Theoretical Framework and Applications in Cryptocurrency,2025,International Journal of Financial Studies,10.3390/ijfs13040220,https://doi.org/10.3390/ijfs13040220,yes
30582038a7ba,Periodic Unitary Encoding for Quantum Anomaly Detection of Temporal Series,2025,IQSOFT,10.5220/0013537800004525,https://doi.org/10.5220/0013537800004525,yes
30afc00e8912,Integration of parameterized quantum circuits within classical neural network for financial time-series prediction,2025,Quantum Machine Intelligence,10.1007/s42484-025-00265-5,https://doi.org/10.1007/s42484-025-00265-5,yes
30c35313cb34,"Quantum computing in financial portfolio optimization: Case-based insights into efficiency, risk management, and market impact",2025,International Journal of Advanced Academic Studies,10.33545/27068919.2025.v7.i3a.1570,https://doi.org/10.33545/27068919.2025.v7.i3a.1570,yes
311bac170c43,Application of Quantum Computing in Optimization Problems,2024,Modeling Control and Information Technologies,10.31713/mcit.2024.033,https://doi.org/10.31713/mcit.2024.033,yes
313a1d740d27,Quantum Kernel methods for anomaly detection in high-velocity data streams,2025,World Journal of Advanced Engineering Technology and Sciences,10.30574/wjaets.2025.15.2.0694,https://doi.org/10.30574/wjaets.2025.15.2.0694,yes
323683ff9874,Time Series Forecasting Using Quantum Machine Learning Algorithms,2025,Algorithms for intelligent systems,10.1007/978-981-97-6957-5_16,https://doi.org/10.1007/978-981-97-6957-5_16,yes
32f23740c07f,hgribeirogeo/qaoa-carbon-cerrado: v2.0 - Seven-Run Validation Study,2026,Zenodo (CERN European Organization for Nuclear Research),10.5281/zenodo.18418053,https://doi.org/10.5281/zenodo.18418053,yes
32f6aa86e556,Quantum Finance Optimization Qubits (QFOQ): An Approach to Accelerate Financial Model Testing,2025,SSRN Electronic Journal,10.2139/ssrn.5007468,https://doi.org/10.2139/ssrn.5007468,yes
3318d42b7459,Quantum Computing Strategy,2025,,10.1201/9781003302674,https://doi.org/10.1201/9781003302674,yes
3432da9937d2,A Variable-Angle-Distance Quantum Evolutionary Algorithm for 2D HP Model,2018,"International Conference on Communication, Computing & Security",10.1007/978-3-030-00021-9_30,https://doi.org/10.1007/978-3-030-00021-9_30,yes
3453ddc0d7db,Numerical solution of boundary value problems using quantum computing system,2025,International Journal of System of Systems Engineering,10.1504/ijsse.2025.151321,https://doi.org/10.1504/ijsse.2025.151321,yes
34a99682d20c,QEKLR: quantum-enhanced kernel logistic regression for classification,2025,The Journal of Supercomputing,10.1007/s11227-025-07266-y,https://doi.org/10.1007/s11227-025-07266-y,yes
3506790b2a7a,HQRNN-FD: A Hybrid Quantum Recurrent Neural Network for Fraud Detection,2025,Entropy,10.3390/e27090906,https://doi.org/10.3390/e27090906,yes
35505140af55,Quantum Computing for Fraud Detection in Real-Time Payment Systems,2025,,10.1109/icctdc64446.2025.11158810,https://doi.org/10.1109/icctdc64446.2025.11158810,yes
35c7b4d830d5,Market informed portfolio optimization methods with hybrid quantum computing,2024,Review of Financial Economics,10.1002/rfe.1219,https://doi.org/10.1002/rfe.1219,yes
36cd7ccae10c,AI-Powered Risk Modeling in Quantum Finance : Redefining Enterprise Decision Systems,2022,International Journal of Scientific Research in Science Engineering and Technology,10.32628/ijsrset221656,https://doi.org/10.32628/ijsrset221656,yes
37f43983f4d2,Quantum Computing: <i>Implications for Portfolio Managers</i>,2016,The Journal of Investing,10.3905/joi.2016.25.3.081,https://doi.org/10.3905/joi.2016.25.3.081,yes
394db2cbf8da,Quantum Approximate Optimization Algorithm for Portfolio Selection: A Comparative Study with Classical Markowitz Optimization,2026,SSRN Electronic Journal,10.2139/ssrn.5793303,https://doi.org/10.2139/ssrn.5793303,yes
3adb18321a79,Quantum Quantitative Trading: High-Frequency Statistical Arbitrage Algorithm,2021,arXiv,10.1088/1367-2630/ac7f26,https://doi.org/10.1088/1367-2630/ac7f26,yes
3bd0da5c69ac,"PREreview of ""The Inverse Born Rule Fallacy: On the Informational Limits of Phase-Locked Amplitude Encoding""",2026,Zenodo (CERN European Organization for Nuclear Research),10.5281/zenodo.18793265,https://doi.org/10.5281/zenodo.18793265,yes
3d6d6393f792,A Comparison on Constrain Encoding Methods for Quantum Approximate Optimization Algorithm,2024,International Conference on Computer Aided Design,10.1145/3676536.3697126,https://doi.org/10.1145/3676536.3697126,yes
3f4c5ad6749d,Quantum unary approach to option pricing,2019,Physical Review A,10.1103/PHYSREVA.103.032414,https://doi.org/10.1103/PHYSREVA.103.032414,yes
3f8ab7317ca4,Extrapolation method to optimize linear-ramp quantum approximate optimization algorithm parameters: Evaluation of runtime scaling,2026,"Physical review. A/Physical review, A",10.1103/l5r4-zcqv,https://doi.org/10.1103/l5r4-zcqv,yes
3fb78ea9b31b,Quantum beetle antennae search: a novel technique for the constrained portfolio optimization problem,2021,Science China Information Sciences,10.1007/s11432-020-2894-9,https://doi.org/10.1007/s11432-020-2894-9,yes
3fe2b056b181,Research on the optimization of credit score card for solving the QUBO model based on annealing algorithm and quantum computer,2023,"International Conferences on Computers, Information Processing and Advanced Education",10.1109/CIPAE60493.2023.00120,https://doi.org/10.1109/CIPAE60493.2023.00120,yes
3fe31dea1f88,Quantum Risk Analysis: Beyond (Conditional) Value-at-Risk,2022,Quantum Economics and Finance,10.1177/29767032251377083,https://doi.org/10.1177/29767032251377083,yes
40ca827d69b9,FRAUD DETECTION USING RESTRICTED BOLTZMANN MACHINES ASSISTED BY QUANTUM COMPUTING,2025,,10.17771/pucrio.acad.73105,https://doi.org/10.17771/pucrio.acad.73105,yes
40e4c7fdd4ac,Dynamic Portfolio Optimization with Real Datasets Using Quantum Processors and Quantum-Inspired Tensor Networks,2020,Physical Review Research,10.1103/PhysRevResearch.4.013006,https://doi.org/10.1103/PhysRevResearch.4.013006,yes
413125f4264b,Derivative Pricing and Credit Risk in a Regime Switching Economy Using Quantum Amplitude Estimation,2024,,10.1109/qce60285.2024.00067,https://doi.org/10.1109/qce60285.2024.00067,yes
41c620c565b5,Solving Multiple Discretization Portfolio Optimization Problem with Quantum-Classical Hybrid Algorithms,2025,Computational Economics,10.1007/s10614-025-11061-5,https://doi.org/10.1007/s10614-025-11061-5,yes
41d2d7bb257a,Enhancing Credit Risk Prediction Through Co-Trained Hybrid Quantum Transfer Learning Model,2025,2025 IEEE International Conference on Quantum Artificial Intelligence (QAI),10.1109/QAI63978.2025.00021,https://doi.org/10.1109/QAI63978.2025.00021,yes
4244a7279692,Scheduling Process of Quantum Circuits to Optimize Tasks Execution on Quantum Computers,2024,,10.1109/qce60285.2024.10275,https://doi.org/10.1109/qce60285.2024.10275,yes
4255cabe0f56,Quantum Algorithm for Option Pricing,2023,,10.1007/978-981-19-7517-2_14,https://doi.org/10.1007/978-981-19-7517-2_14,yes
439a750eda8c,Quantum-inspired variational algorithms for partial differential equations: application to financial derivative pricing,2022,Quantitative finance (Print),10.1080/14697688.2023.2259954,https://doi.org/10.1080/14697688.2023.2259954,yes
455f0fa41521,Research on the Design of Financial Data Analysis Platform with Joint PSO-HQCNN and RPA Robot Visualization Technology,2024,IEIE Transactions on Smart Processing and Computing,10.5573/ieiespc.2024.10.13.5.472,https://doi.org/10.5573/ieiespc.2024.10.13.5.472,yes
45bb659a6bb7,The Quantum Future of Finance Applications,2025,,10.4018/979-8-3373-2893-5.ch003,https://doi.org/10.4018/979-8-3373-2893-5.ch003,yes
45e4cb39dba8,Applications of quantum computing to optimization,2021,"2021 IEEE CHILEAN Conference on Electrical, Electronics Engineering, Information and Communication Technologies (CHILECON)",10.1109/chilecon54041.2021.9703081,https://doi.org/10.1109/chilecon54041.2021.9703081,yes
464916b2b572,Improving the Sequence Alignment Method by Quantum Multi-Pattern Recognition,2018,Hellenic Conference on Artificial Intelligence,10.1145/3200947.3201041,https://doi.org/10.1145/3200947.3201041,yes
468c3327bdef,Quantum Computing in US Banking: The Future of Fraud Prevention and Financial Crime Detection,2025,Global Journal of Emerging AI and Computing,10.70445/gjeac.1.2.2025.31-50,https://doi.org/10.70445/gjeac.1.2.2025.31-50,yes
46e6281cc0ea,A quantum feature selection framework via ground state preparation,2023,Physica Scripta,10.1088/1402-4896/ad0184,https://doi.org/10.1088/1402-4896/ad0184,yes
