paper_id,title,year,venue,doi,doi_url,has_doi
e40a21367703,Stock price prediction: a comparative analysis of classical and quantum neural networks,2024,"East African Journal of Science, Technology and Innovation",10.37425/2hj0r024,https://doi.org/10.37425/2hj0r024,yes
e4a9bb7f1bbb,Exploring Quantum Machine Learning Algorithms for Enhanced Data Classification and Clustering in Complex Systems - Integration with Gradient Boosting and K-means for Improved Performance,2024,,10.1109/cybercom63683.2024.10803157,https://doi.org/10.1109/cybercom63683.2024.10803157,yes
e4bb7333aaa5,Variational quantum eigensolver with linear depth problem-inspired ansatz for solving portfolio optimization in finance,2024,Science China Information Sciences,10.1007/s11432-024-4185-1,https://doi.org/10.1007/s11432-024-4185-1,yes
e4ff7159708b,Simulating the non-Hermitian dynamics of financial option pricing with quantum computers,2024,arXiv,10.1038/s41598-025-97245-3,https://doi.org/10.1038/s41598-025-97245-3,yes
e513378d8c92,"AI, Data Science, and Quantum Neural Networks in E‑Commerce: Methods, Applications, Risks, and a Research Roadmap",2022,,10.64206/pp5nd013,https://doi.org/10.64206/pp5nd013,yes
e52f3f130a75,A Hybrid Graph-Based Evolutionary Optimization Model Using SparseEA-AGDS for Secure and Scalable Workload Partitioning in Hybrid Quantum-Classical Systems,2026,Journal of Internet Services and Information Security,10.58346/jisis.2026.i1.038,https://doi.org/10.58346/jisis.2026.i1.038,yes
e53a9047880e,Hybrid Quantum-Classical Neural Network (HQCNN) for Crypto Price Forecasting,2025,"2025 3rd International Conference on Artificial Intelligence, Blockchain, and Internet of Things (AIBThings)",10.1109/AIBThings66987.2025.11296267,https://doi.org/10.1109/AIBThings66987.2025.11296267,yes
e667225d4f3c,ADVANCING FINANCIAL PREDICTION THROUGH QUANTUM MACHINE LEARNING,2025,International Journal of Intelligent Data and Machine Learning,10.55640/ijidml-v02i02-01,https://doi.org/10.55640/ijidml-v02i02-01,yes
e69606eda4d4,Deep Neural Networks and Fan Tokens’ Pricing in Football Clubs,2025,Journal of Intelligent &amp; Fuzzy Systems: Applications in Engineering and Technology,10.1177/18758967251388256,https://doi.org/10.1177/18758967251388256,yes
e71143fc75ea,Quantum Optimization of Currency Arbitrage via Graph-Informed Entanglement Strategies,2025,International Conference on AI in Finance,10.1145/3768292.3770352,https://doi.org/10.1145/3768292.3770352,yes
e7e84a5252aa,Quantum Computing Approach to Realistic ESG-Friendly Stock Portfolios,2024,Risks,10.3390/risks12040066,https://doi.org/10.3390/risks12040066,yes
e8140e32d73c,Solving Large‐Scale Linear Systems of Equations by a Quantum Hybrid Algorithm (Ann. Phys. 7/2022),2022,Annalen der Physik,10.1002/andp.202270014,https://doi.org/10.1002/andp.202270014,yes
e82f44de737a,&lt;p&gt;&lt;b&gt;&lt;i&gt;Application of Quantum Computing Algorithms for Optimization of Tactical Asset Allocation in &lt;span&gt;&amp;nbsp;&lt;/span&gt;Portfolio Management&lt;/i&gt;&lt;/b&gt;&lt;/p&gt;,2025,SSRN Electronic Journal,10.2139/ssrn.5257790,https://doi.org/10.2139/ssrn.5257790,yes
e8333614ccce,CCA³-SGAD: Quantum Amplitude Amplification for Combinatorial Search on Sparse Graphs,2026,Zenodo (CERN European Organization for Nuclear Research),10.5281/zenodo.18843183,https://doi.org/10.5281/zenodo.18843183,yes
e884248dc62e,Clock Quantum Monte Carlo: an imaginary-time method for real-time quantum dynamics,2014,arXiv,10.1103/PhysRevA.91.012311,https://doi.org/10.1103/PhysRevA.91.012311,yes
e8b9674d7c5e,Driving Operational Efficiency in Finance Through Strategic Automation and Process Optimization,2025,Journal of Computer Science and Technology Studies,10.32996/jcsts.2025.7.7.105,https://doi.org/10.32996/jcsts.2025.7.7.105,yes
e922f913e80b,Quantum algorithm for solving McKean-Vlasov stochastic differential equations,2025,EPJ Quantum Technology,10.1140/epjqt/s40507-025-00453-z,https://doi.org/10.1140/epjqt/s40507-025-00453-z,yes
e9b892fcd6fc,Toward Efficient Credit Card Fraud Detection: Leveraging Quantum Neural Networks and Modified Feature Selection Techniques,2025,Journal of Machine and Computing,10.53759/7669/jmc202505024,https://doi.org/10.53759/7669/jmc202505024,yes
e9e49c657667,Scenario-Based Macroeconomic and Financial Forecasting Using Quantum-Enhanced Models,2026,Next Generation Journal for The Young Researchers,10.62802/zacbaj90,https://doi.org/10.62802/zacbaj90,yes
ea3050e19cb2,11 Unveiling intelligence: exploring variational quantum circuits as machine learning models,2024,,10.1515/9783111342276-011,https://doi.org/10.1515/9783111342276-011,yes
ea4504852540,"Quantum Binomial Tree, an Exponential Speedup for Derivative Pricing",2022,SSRN Electronic Journal,10.2139/ssrn.4216595,https://doi.org/10.2139/ssrn.4216595,yes
ea4b39301625,Improved Quantum Approximate Optimization Algorithm based on Conditional Value-at-Risk for Portfolio Optimization,2024,Research Square (Research Square),10.21203/rs.3.rs-4582391/v1,https://doi.org/10.21203/rs.3.rs-4582391/v1,yes
eb49db8c70eb,derivatives_pricing_visualizer.py — Disruptive Derivatives Pricing Visualizer,2025,Zenodo (CERN European Organization for Nuclear Research),10.5281/zenodo.18014195,https://doi.org/10.5281/zenodo.18014195,yes
ebbdd376073e,Quantum Algorithm for Copula-Based Risk Aggregation using Orthogonal Series Density Estimation,2024,International Conference on Quantum Computing and Engineering,10.1109/QCE60285.2024.00046,https://doi.org/10.1109/QCE60285.2024.00046,yes
ebc4087b5ca1,Quantum-Resistant Artificial Intelligence and Machine Learning Architectures for Secure Mortgage and Banking Intelligence Systems,2024,,10.70593/978-93-7185-228-9,https://doi.org/10.70593/978-93-7185-228-9,yes
ebc427ff9eca,The Semicircle Constraint: Geometric Foundations for Variational Quantum Algorithm Optimization,2026,Zenodo (CERN European Organization for Nuclear Research),10.5281/zenodo.18406224,https://doi.org/10.5281/zenodo.18406224,yes
ec46c4209f52,Optimal Tuning of Quantum Generative Adversarial Networks for Multivariate Distribution Loading,2022,Quantum Reports,10.3390/quantum4010006,https://doi.org/10.3390/quantum4010006,yes
ecd17525083d,Quantum Approximate Optimization Algorithm for Large-Scale Portfolio Selection with Multi-Factor Constraints,2025,Next Generation Journal for The Young Researchers,10.62802/xce3gn85,https://doi.org/10.62802/xce3gn85,yes
ed02e34c2236,Quantum Computing: A Beginner's Guide To Future Processing,2026,Zenodo (CERN European Organization for Nuclear Research),10.5281/zenodo.18919206,https://doi.org/10.5281/zenodo.18919206,yes
ed0de8d44eff,Quantum Thinking in Finance,2026,,10.58445/rars.3542,https://doi.org/10.58445/rars.3542,yes
eedf4aad8fda,A Survey on Quantum Computational Finance for Derivatives Pricing and VaR,2022,Archives of Computational Methods in Engineering,10.1007/s11831-022-09732-9,https://doi.org/10.1007/s11831-022-09732-9,yes
ef5568395d8c,Financial Performance Analysis in European Football Clubs,2020,Entropy,10.3390/e22091056,https://doi.org/10.3390/e22091056,yes
ef887b17024e,Unveiling Advanced Computational Applications in Quantum Computing: A Comprehensive Review,2023,International Journal of Advanced Nano Computing and Analytics,10.61797/ijanca.v2i2.284,https://doi.org/10.61797/ijanca.v2i2.284,yes
ef9db5fc8faa,Reinforcement Learning Meets Quantum Optimization: A New Paradigm for Dynamic Portfolio Management,2025,Global Journal of Intelligent Technologies,10.64206/yk0c9a08,https://doi.org/10.64206/yk0c9a08,yes
f02939adf369,Power Law Amplitude Estimation for Option Pricing with NISQ Devices,2024,Advanced Quantum Technologies,10.1002/qute.202400411,https://doi.org/10.1002/qute.202400411,yes
f054252b17db,Adaptive AI and quantum computing for real-time financial fraud detection and cyber-attack prevention in U.S. healthcare,2025,World Journal of Advanced Research and Reviews,10.30574/wjarr.2025.26.2.1767,https://doi.org/10.30574/wjarr.2025.26.2.1767,yes
f0cfc9685e15,Optimizing Feature Selection for Predictive Analytics With Quantum Algorithms,2024,"Advances in marketing, customer relationship management, and e-services book series",10.4018/979-8-3693-7673-7.ch009,https://doi.org/10.4018/979-8-3693-7673-7.ch009,yes
f1cdc4d681b5,Unraveling the Effect of COVID-19 on the Selection of Optimal Portfolio Using Hybrid Quantum-Classical Algorithms,2022,2022 IEEE International Conference on Quantum Computing and Engineering (QCE),10.1109/qce53715.2022.00154,https://doi.org/10.1109/qce53715.2022.00154,yes
f2dee5528891,Exploring Quantum Computing Algorithms for Optimization Problems,2025,International Journal on Advanced Computer Theory and Engineering,10.65521/ijacte.v13i1.92,https://doi.org/10.65521/ijacte.v13i1.92,yes
f35eb73554d8,Quantum Machine Learning: Algorithms and Applications in Quantum Computing,2025,International Journal on Advanced Electrical and Computer Engineering,10.65521/ijaece.v13i1.81,https://doi.org/10.65521/ijaece.v13i1.81,yes
f362fd204c2b,Hybrid Classical-Quantum Generative Algorithms for Financial Modelling and Prediction,2025,,10.1109/ic363308.2025.10956507,https://doi.org/10.1109/ic363308.2025.10956507,yes
f3998e794c14,A Review on High-Frequency Trading Forecasting Methods: Opportunity and Challenges for Quantum Based Method,2024,IEEE Access,10.1109/ACCESS.2024.3418458,https://doi.org/10.1109/ACCESS.2024.3418458,yes
f3cb59fe38ac,Utilizing Graph Neural Networks (GNN) in Quantum-Natural Language Processing (Q-NLP) for Risk Management in Banking Sector: A Novel Approach,2025,Graph Neural Networks Essentials and Use Cases,10.1007/978-3-031-88538-9_6,https://doi.org/10.1007/978-3-031-88538-9_6,yes
f4883fc328d4,Error-Resilient Quantum Machine Learning for Real-World Optimization Problems in Finance and Supply Chain Networks,2025,InPrime Indonesian Journal of Pure and Applied Mathematics,10.15408/inprime.v7i1.44960,https://doi.org/10.15408/inprime.v7i1.44960,yes
f55fea197b67,Comparative analysis of loan risk forecasting using quantum machine learning and classical machine learning models,2025,,10.21203/rs.3.rs-7907390/v1,https://doi.org/10.21203/rs.3.rs-7907390/v1,yes
f5adfe23aa3d,Quantum optimization techniques and applications,2025,Advances in computers,10.1016/bs.adcom.2025.06.001,https://doi.org/10.1016/bs.adcom.2025.06.001,yes
f67b13b40931,Integration of innovative business models using quantum computing and generative AI,2025,,10.1201/9781003597414-23,https://doi.org/10.1201/9781003597414-23,yes
f85bdc99d9eb,Quantum computing for finance,2023,Nature Reviews Physics,10.1038/s42254-023-00603-1,https://doi.org/10.1038/s42254-023-00603-1,yes
f8669d109a5f,Quantum Computing-The Underlying Principle Behind it,2025,Prabha Materials Science Letters,10.33889/pmsl.2025.4.2.020,https://doi.org/10.33889/pmsl.2025.4.2.020,yes
f88bb4cc0c22,Systematic Review on the Influence of Classical and Quantum Machine Learning in the Financial Sector,2026,Data Science and Management,10.1016/j.dsm.2026.01.001,https://doi.org/10.1016/j.dsm.2026.01.001,yes
f92cf78ba56a,"A comparative insight into peptide folding with quantum CVaR-VQE algorithm, MD simulations and structural alphabet analysis",2024,Quantum Information Processing,10.1007/s11128-024-04261-9,https://doi.org/10.1007/s11128-024-04261-9,yes
f94276561f48,Generative Learning with Qopula Circuits,2024,International Conference on Communication Systems and Networks,10.1109/COMSNETS59351.2024.10427073,https://doi.org/10.1109/COMSNETS59351.2024.10427073,yes
f9a4ea0df88e,Quantum Time-Energy Theory (QTET) & UTRER: AFFIDAVIT,2025,Zenodo (CERN European Organization for Nuclear Research),10.5281/zenodo.17512580,https://doi.org/10.5281/zenodo.17512580,yes
f9f0249a4f6d,Advanced Equivalence Checking for Quantum Circuits,2020,IEEE Transactions on Computer-Aided Design of Integrated Circuits and Systems,10.1109/TCAD.2020.3032630,https://doi.org/10.1109/TCAD.2020.3032630,yes
fb499d357762,A quantum portfolio optimization algorithm based on hard constraint and warm starting,2025,Dianzi Keji Daxue Xuebao Journal of the University of Electronic Science and Technology of China,10.12178/1001-0548.2024162,https://doi.org/10.12178/1001-0548.2024162,yes
fc82cb4fddfa,Quadratic Unconstrained Binary Optimization Approach for Incorporating Solvency Capital into Portfolio Optimization,2024,Risks,10.3390/risks12020023,https://doi.org/10.3390/risks12020023,yes
fd31c17753a0,Financial fraud detection using a hybrid deep belief network and quantum optimization approach,2025,Discover Applied Sciences,10.1007/s42452-025-06999-y,https://doi.org/10.1007/s42452-025-06999-y,yes
fd5b3f400773,Quantum Computing and the Future of Finance: Exploring How Quantum Technology Impacts Financial Analysis and Forecasting,2026,Zenodo (CERN European Organization for Nuclear Research),10.5281/zenodo.18492589,https://doi.org/10.5281/zenodo.18492589,yes
fd6d12958e8e,Quantum Computing for Cryptography: Breaking Encryption Algorithms,2026,International Journal for Research in Applied Science and Engineering Technology,10.22214/ijraset.2026.77826,https://doi.org/10.22214/ijraset.2026.77826,yes
fdc49be32988,Coherent feed-forward quantum neural network,2024,Quantum Machine Intelligence,10.1007/s42484-024-00222-8,https://doi.org/10.1007/s42484-024-00222-8,yes
fecff5249e72,Quantum-enhanced analysis of discrete stochastic processes,2020,npj Quantum Information,10.1038/s41534-021-00459-2,https://doi.org/10.1038/s41534-021-00459-2,yes
ff36740b3b52,Quantum powered credit risk assessment: a novel approach using Hybrid Quantum-Classical Deep Neural Network for Row-Type Dependent Predictive Analysis,2025,EPJ Quantum Technology,10.1140/epjqt/s40507-025-00323-8,https://doi.org/10.1140/epjqt/s40507-025-00323-8,yes
ff9ec9ec394a,Advancements in Quantum Computing and Information Science,2024,,10.62311/nesx/97820,https://doi.org/10.62311/nesx/97820,yes
0067a26ce270,Quantum algorithm for stochastic optimal stopping problems,2021,arXiv (Cornell University),,,no
01326ce2213f,"Quantum Chebyshev Transform: Mapping, Embedding, Learning and Sampling Distributions",2023,arXiv,,,no
05a01a257cc7,Large-scale portfolio optimization using Pauli Correlation Encoding,2025,,,,no
0608ad48d5b8,Pricing ﬁnancial derivatives with exponential quantum speedup,2021,,,,no
076cb93860b0,Quantum Bayesian networks with application to games displaying Parrondo's paradox,2015,arXiv,,,no
081132e62980,Quantum Algorithm for Local-Volatility Option Pricing via the Kolmogorov Equation,2025,ArXiv.org,,,no
0d4d912721cf,H-EFT-VA: An Effective-Field-Theory Variational Ansatz with Provable Barren Plateau Avoidance,2026,ArXiv.org,,,no
1312e9d3c55e,Hybrid Quantum-Classical Machine Learning with PennyLane: A Comprehensive Guide for Computational Research,2025,arXiv,,,no
136790c5fbc5,Space and Time Cost of Continuous Rotations in Surface Codes,2025,,,,no
1694a492105e,Accelerating variational quantum Monte Carlo using the variational quantum eigensolver,2023,arXiv,,,no
17bf34700dca,Capturing dynamics with noisy quantum computers,2026,Leiden Repository (Leiden University),,,no
1938aae185de,Quantum-enhanced Markov Chain Monte Carlo for Combinatorial Optimization,2026,,,,no
1b63c3136291,A Comparative Study of Quantum Optimization Techniques for Solving Combinatorial Optimization Benchmark Problems,2025,,,,no
1b7d8c497d7d,A Generalized Quantum Inner Product and Applications to Financial Engineering,2022,arXiv.org,,,no
1bc4675bdbc6,Discrete-Time Quantum Walk of a Bose-Einstein Condensate in Momentum Space,2018,SHAREOK (University of Oklahoma; Oklahoma State University; Central Oklahoma University),,,no
1bf880322e6f,Quantum Speedups for Derivative Pricing Beyond Black-Scholes,2026,,,,no
1c1c816351f4,Gravitational wave matched filtering by quantum Monte Carlo integration and quantum amplitude amplification,2022,arXiv,,,no
1d16f793a68b,Quantum neural network for continuous variable prediction,2022,,,,no
1d715e0cd1aa,"HQFS: Hybrid Quantum Classical Financial Security with VQC Forecasting, QUBO Annealing, and Audit-Ready Post-Quantum Signing",2026,,,,no
2322e385b8e7,Differential Evolution VQE for Crypto-currency Arbitrage. Quantum Optimization with many local minima,2023,arXiv,,,no
25b9eceec1f2,Performance Comparison of QAOA Mixers for Ternary Portfolio Optimization,2026,,,,no
292400fdfae6,Quantum algorithms for differential equations in finance and physics,2025,Communities in ADDI (University of the Basque Country),,,no
296dd193c78f,A framework to evaluate the performance of Variational Quantum Algorithms,2026,,,,no
2bb96fecae4b,Portfolio rebalancing experiments using the Quantum Alternating Operator Ansatz,2019,,,,no
2c74be1a024b,Quantum speedup for combinatorial optimization with flat energy landscapes,2023,arXiv,,,no
2fa8a733b41d,Realization of a quantum walk in momentum space with a Bose-Einstein condensate,2018,arXiv (Cornell University),,,no
320ac2390210,Explicit block-encoding for partial differential equation-constrained optimization,2025,,,,no
32be27773fc7,Training Knowledge Transfer for Adaptive Portfolio Rebalancing Based on Trend Ratio with Quantum-inspired Optimization System,2025,Journal of the Association for Information Systems,,,no
33968c404556,Circuit Design based on Feature Similarity for Quantum Generative Modeling,2025,,,,no
36432eaf1f31,Characterizing asymmetric and bimodal long-term financial return distributions through quantum walks,2025,,,,no
39e897283cac,Exploring the synergistic potential of quantum annealing and gate model computing for portfolio optimization,2023,,,,no
3a3ba897009d,QAOA applied to the portfolio optimization problem,2023,LA Referencia (Red Federada de Repositorios Institucionales de Publicaciones Científicas),,,no
3a4b78215cc7,Real Option Pricing using Quantum Computers,2023,,,,no
3c1b7774da65,Black-Litterman Portfolio Optimization with Noisy Intermediate-Scale Quantum Computers,2023,arXiv,,,no
412a4331b358,Software for Creating Scalable Benchmarks from Quantum Algorithms,2025,ArXiv.org,,,no
41a852fada38,Quantum Analysis of Continuous Time Stochastic Process,2022,,,,no
47412220e1bb,Quantum Computational Algorithms for Derivative Pricing and Credit Risk in a Regime Switching Economy,2023,,,,no
48cd8220e3b2,Entanglement scaling in matrix product state representation of smooth functions and their shallow quantum circuit approximations,2024,,,,no
4ceae3900931,VARIATIONAL QUANTUM ALGORITHMS FOR DERIVATIVE PRICING,2024,National University of Singapore,,,no
4dc6746d80a2,Uncertainty and symmetry bound for the total detection probability of quantum walks,2019,arXiv (Cornell University),,,no
4de005c12725,Automated Function Implementation via Conditional Parameterized Quantum Circuits with Applications to Finance,2023,,,,no
4ee4d5f63858,The Potential of Quantum Techniques for Stock Price Prediction,2023,arXiv,,,no
55cbe84d64e7,Quantum Speedup of Monte Carlo Integration in the Direction of Dimension and its Application to Finance,2020,arXiv (Cornell University),,,no
59cca9744140,Quantum State Preparation by Improved MPS Method,2025,,,,no
629ad7ff1054,Financial Market Modeling with Quantum Neural Networks,2015,arXiv,,,no
631717352091,Monte-Carlo Option Pricing in Quantum Parallel,2025,,,,no
67f83161d410,A Survey of Quantum Computing for Finance,2022,,,,no
68b9ec9dea63,Quantum-Enhanced Temporal Embeddings via a Hybrid Seq2Seq Architecture,2026,ArXiv.org,,,no
69bf4c1b7cbe,A Quantum-Inspired Binary Optimization Algorithm for Representative Selection,2023,arXiv,,,no
69bfce9095d0,Genetically Engineered Quantum Circuits for Financial Market Indicators,2025,,,,no
6cb040f251ff,Quantum Algorithm for Local-Volatility Option Pricing via the Kolmogorov Equation,2025,arXiv,,,no
6e0380dce3b2,Accelerating Quantum Monte Carlo Calculations with Set-Equivariant Architectures and Transfer Learning,2025,arXiv,,,no
6e6696a9c05a,Quantum Time Series Similarity Measures and Quantum Temporal Kernels,2023,,,,no
70217d6e8f7f,Hybrid Quantum-Classical Algorithm For Robust Optimization via Stochastic-Gradient Online Learning,2023,,,,no
75a7b04fa681,Encoding of Probability Distributions for Quantum Monte Carlo Using Tensor Networks,2024,arXiv,,,no
774364c6da63,hqQUBO: A Hybrid-querying Quantum Optimization Model Validated with 16-qubits on an Ion Trap Quantum Computer for Life Science Applications,2025,,,,no
79a526ef5902,Arline Benchmarks: Automated Benchmarking Platform for Quantum Compilers,2022,arXiv.org,,,no
7c11ab76f3d9,Benchmarking Quantum Solvers in Noisy Digital Simulations for Financial Portfolio Optimization,2025,,,,no
7c6e8af63f61,Constrained Portfolio Optimization via Quantum Approximate Optimization Algorithm (QAOA) with XY-Mixers and Trotterized Initialization: A Hybrid Approach for Direct Indexing,2026,ArXiv.org,,,no
7c795b799d02,Credit Default Prediction with Projected Quantum Feature Models and Ensembles,2025,,,,no
7e5d0a8fc172,Quadratic Speed-up in Infinite Variance Quantum Monte Carlo,2024,arXiv,,,no
7f91dcfbca63,"Quantum-inspired anomaly detection, a QUBO formulation",2023,,,,no
822dbee7acfe,Scaling Portfolio Diversification with Quantum Circuit Cutting Techniques,2025,,,,no
8372b98f0875,Unsupervised quantum machine learning for fraud detection,2022,,,,no
852010d3745d,Combinatorial Amplitude Patterns via Nested Quantum Affine Transformations,2024,,,,no
8bb680c2fb8b,Quantum computing: Challenges and opportunities,2020,Cascon 2019 Proceedings Conference of the Centre for Advanced Studies on Collaborative Research Proceedings of the 29th Annual International Conference on Computer Science and Software Engineering,,,no
8d8d76478f6b,Quantum Monte Carlo Simulations for predicting electron-positron pair production via the linear Breit-Wheeler process,2026,arXiv,,,no
8f553bfb1077,"A quantum spectral method for simulating stochastic processes, with applications to Monte Carlo",2023,,,,no
92948f73b470,Quantum Data Learning of Topological-to-Ferromagnetic Phase Transitions in the 2+1D Toric Code Loop Gas Model,2025,arXiv,,,no
9405b3330b09,Quantum classical hybrid neural networks for continuous variable prediction,2022,,,,no
94dbaa0bc6b4,Fundamental theorem for quantum asset pricing,2022,arXiv,,,no
955dd8044889,Quantum Finance: a tutorial on quantum computing applied to the financial market,2022,,,,no
9b3837c81545,Portfolio Management Using Market Graph and Reinforcement Learning,2024,TSpace,,,no
a2b747cae698,Quantum Heavy-tailed Bandits,2023,arXiv,,,no
a4cb146201fc,Quantum propensity in economics,2021,arXiv,,,no
aeba35e547c4,"Efficient Evaluation of Exponential and Gaussian Functions on a Quantum Computer, with Application to Quantum Computational Chemistry and Quantum Finance",2023,,,,no
b4397d93ce2f,Benchmarking Amplitude Estimation on a Superconducting Quantum Computer,2022,,,,no
b7c9696b8ffc,Quantum Adversarial Learning in Emulation of Monte-Carlo Methods for Max-cut Approximation: QAOA is not optimal,2022,arXiv,,,no
b8057faa8a23,Exponentially Improved Constant in Quantum Solution Extraction,2025,arXiv,,,no
bb719c33a7f1,Comparative Study of Quantum-Circuit Scalability in a Financial Problem,2024,,,,no
c1358ec0f6a6,Quantum Computation for Pricing Caps using the LIBOR Market Model,2022,,,,no
c233bf88de0f,On Quantum BSDE Solver for High-Dimensional Parabolic PDEs,2025,arXiv,,,no
c47a454352d5,Preparing random state for quantum financing with quantum walks,2023,,,,no
c48c60134357,Statistics-Informed Parameterized Quantum Circuit via Maximum Entropy Principle for Data Science and Finance,2024,,,,no
c56a3ba7d912,Quantum Reservoir Computing for Credit Card Default Prediction on a Neutral Atom Platform,2025,,,,no
c70de9d73132,Real-time Sign-Problem-Suppressed Quantum Monte Carlo Algorithm For Noisy Quantum Circuit Simulations,2025,arXiv,,,no
c7451962353b,QUANTUM COMPUTING IN FINANCIAL RISK MANAGEMENT AND PORTFOLIO OPTIMIZATION,2025,Open MIND,,,no
cab849abe702,Diagram-to-Circuit QNLP for Financial Sentiment Analysis,2025,ArXiv.org,,,no
cd5dc35d5f39,Fraud detection in credit card transactions using Quantum-Assisted Restricted Boltzmann Machines,2025,ArXiv.org,,,no
cde1c896dc3c,Quantum Machine Learning for Finance,2021,arXiv.org,,,no
cf803ec26409,Quasi-binary encoding based quantum alternating operator ansatz,2023,,,,no
d18096ef8f4c,Financial Portfolio Optimization: a QUBO Formulation for Sharpe Ratio Maximization,2023,,,,no
d255ff5edaae,Toward quantum advantage: Quantum variational algorithms for NP-hard approximations,2023,Digital Access to Scholarship at Harvard (DASH) (Harvard University),,,no
d349fc59251c,Preparing Arbitrary Continuous Functions in Quantum Registers With Logarithmic Complexity,2022,arXiv,,,no
d5410f88017c,Composite QDrift-Product Formulas for Quantum and Classical Simulations in Real and Imaginary Time,2023,arXiv,,,no
d7449b1ba0c5,Improving credit card transaction fraud detection using CVQBoosting,2026,Singapore Management University Institutional Knowledge (InK) (Singapore Management University),,,no
de580e8c085e,Qudit-based scalable quantum algorithm for solving the integer programming problem,2025,,,,no
de7c20d08bbe,Novel Quantum Circuit Designs of Random Injection and Payoff Computation for Financial Risk Assessment,2025,,,,no
df5b91d07411,Hybrid Photonic Quantum Reservoir Computing for High-Dimensional Financial Surface Prediction,2026,ArXiv.org,,,no
e505ff143d95,Quantum Machine Learning and Optimisation in Finance: Drive financial innovation with quantum-powered algorithms and optimisation strategies,2024,Quantum Machine Learning and Optimisation in Finance Drive Financial Innovation with Quantum Powered Algorithms and Optimisation Strategies,,,no
e6692a4012cb,"Response to ""Exponential challenges in unbiasing quantum Monte Carlo algorithms with quantum computers""",2022,arXiv,,,no
ee8331fcdc90,Designing PSS and SVC Parameters simultaneously through the Improved Quantum Algorithm in the Multi-machine Power System,2018,,,,no
ef99551dab0f,NExt ApplicationS of Quantum Computing D5.1: Review of state-of-the-art for Pricing and Computation of VaR,2021,,,,no
